发文日期|来源|索引号|分类|名称|文号|内容|爬取时间
2019-11-27|上海局|bm56000001/2021-00200998|行政监管措施|关于对中准会计师事务所（特殊普通合伙）采取出具警示函措施的决定|沪证监决〔2019〕180号|中准会计师事务所（特殊普通合伙）： 我局在对上海龙韵传媒集团股份有限公司（以下简称“龙韵股份”）现场检查中关注到，你所在资金占用专项审核中存在以下问题： 新疆愚恒影业集团有限公司作为龙韵股份控股股东段佩璋实际控制的公司，2018年度占用龙韵股份资金累计发生额为36880万元，其中非经营性占用累计发生额32174万元。截至2018年末，有11123.65万元尚未归还，其中非经营性占用9575万元。你所为龙韵股份出具的2018年度控股股东及其他关联方资金占用情况的专项说明（中准专字[2019]第2007号）未如实反映上述资金占用事项。 上述行为违反了《上市公司信息披露管理办法》（证监会令第40号）第五十二条规定。根据《上市公司信息披露管理办法》第六十五条规定，现对你所予以警示。你所应及时采取措施加强内部管理，确保执业质量，并督促相关会计师勤勉尽责履行审核义务。 如果对本监督管理措施不服，可以在收到本决定书之日起60日内向我会（中国证券监督管理委员会）提出行政复议申请，也可以在收到本决定书之日起6个月内向有管辖权的人民法院提起诉讼。复议与诉讼期间，上述监督管理措施不停止执行。 中国证券监督管理委员会上海监管局 2019年11月27日|2024-12-02 09:14:34
2019-11-27|上海局|bm56000001/2021-00200999|行政监管措施|关于对郏嘉琪采取出具警示函措施的决定|沪证监决〔2019〕175号|郏嘉琪： 经查，我局发现你作为兴业证券股份有限公司上海分公司员工，多次向客户推荐非兴业证券股份有限公司发行或代销的金融产品，且参与了部分产品的销售过程。 上述行为违反了《证券经纪人管理暂行规定》（证监会公告﹝2009﹞2号）第十一条第五项、第十三条、第二十七条第一款的规定。根据《证券经纪人管理暂行规定》第二十五条的规定，我局决定对你采取出具警示函的行政监管措施。 如果对本监督管理措施不服，可以在收到本决定书之日起60日内向中国证券监督管理委员会提出行政复议申请，也可以在收到本决定书之日起6个月内向有管辖权的人民法院提起诉讼。复议与诉讼期间，上述监督管理措施不停止执行。 中国证券监督管理委员会上海监管局 2019年11月27日|2024-12-02 09:14:34
2019-11-27|上海局|bm56000001/2021-00201040|行政监管措施|关于对段佩璋采取出具警示函措施的决定|沪证监决〔2019〕179号|段佩璋： 经查，新疆愚恒影业集团有限公司（以下简称“愚恒影业”）作为你本人实际控制的公司，2018年占用上海龙韵传媒集团股份有限公司（以下简称“龙韵股份”）资金累计发生额为36880万元，其中非经营性占用累计发生额32174万元，约占龙韵股份最近一期经审计净资产的37.57%。截至2018年末，有11123.65万元尚未归还，其中非经营性占用9575万元。至2019年7月12日，愚恒影业偿还上述全部款项。上述行为构成控股股东及其关联方非经营占用龙韵股份资金，违反《关于规范上市公司与关联方资金往来及上市公司对外担保若干问题的通知》（证监发[2003]56号）第一条、《上市公司治理准则》（证监发[2002]1号）第十四条的有关规定。龙韵股份未及时将上述控股股东及其关联方非经营性资金占用事项予以披露，亦未在2018年年度报告、2018年度控股股东及其他关联方资金占用情况的专项说明中如实披露，违反《上市公司信息披露管理办法》（证监会令第40号）第二条第一款、第十九条第一款、第三十条及《公开发行证券的公司信息披露内容与格式准则第2号——年度报告的内容与格式》（证监会公告[2017]17号）第三十一条的相关规定。 你作为龙韵股份的控股股东，上述行为违反《关于规范上市公司与关联方资金往来及上市公司对外担保若干问题的通知》第一条、《上市公司治理准则》（证监发[2002]1号）第二十四条、《上市公司治理准则》（证监会公告[2018]29号）第七十条的相关规定；你作为龙韵股份的董事，在履职过程中未勤勉尽责，违反《上市公司信息披露管理办法》第三条的规定。 根据《上市公司信息披露管理办法》第五十八条和第五十九条规定，我局决定对你公司采取出具警示函的行政监管措施。 如果对本监督管理措施不服，可以在收到本决定书之日起60日内向我会（中国证券监督管理委员会）提出行政复议申请，也可以在收到本决定书之日起6个月内向有管辖权的人民法院提起诉讼。复议与诉讼期间，上述监督管理措施不停止执行。  中国证券监督管理委员会上海监管局  2019年11月27日|2024-12-02 09:14:34
2019-11-27|上海局|bm56000001/2021-00201041|行政监管措施|关于对上海龙韵传媒集团股份有限公司采取出具警示函措施的决定|沪证监决〔2019〕178号|上海龙韵传媒集团股份有限公司： 经查，新疆愚恒影业集团有限公司（以下简称“愚恒影业”）作为你公司控股股东段佩璋实际控制的公司，2018年占用你公司资金累计发生额为36880万元，其中非经营性占用累计发生额32174万元，约占你公司最近一期经审计净资产的37.57%。截至2018年末，有11123.65万元尚未归还，其中非经营性占用9575万元。至2019年7月12日，愚恒影业偿还上述全部款项。上述行为构成控股股东及其关联方非经营占用你公司资金，违反《关于规范上市公司与关联方资金往来及上市公司对外担保若干问题的通知》（证监发[2003]56号）第一条、《上市公司治理准则》（证监发[2002]1号）第十四条的有关规定。 你公司未及时将上述控股股东及其关联方非经营性资金占用事项予以披露，亦未在2018年年度报告、2018年度控股股东及其他关联方资金占用情况的专项说明中如实披露，违反《上市公司信息披露管理办法》（证监会令第40号）第二条第一款、第十九条第一款、第三十条及《公开发行证券的公司信息披露内容与格式准则第2号——年度报告的内容与格式》（证监会公告[2017]17号）第三十一条的相关规定。 根据《上市公司信息披露管理办法》第五十九条规定，我局决定对你公司采取出具警示函的行政监管措施。 如果对本监督管理措施不服，可以在收到本决定书之日起60日内向我会（中国证券监督管理委员会）提出行政复议申请，也可以在收到本决定书之日起6个月内向有管辖权的人民法院提起诉讼。复议与诉讼期间，上述监督管理措施不停止执行。  中国证券监督管理委员会上海监管局 2019年11月27日|2024-12-02 09:14:34
2019-11-27|上海局|bm56000001/2021-00201042|行政监管措施|关于对李春第采取出具警示函措施的决定|沪证监决〔2019〕177号|李春第： 经查，中曼石油天然气集团股份有限公司（以下简称中曼石油）全资子公司中曼石油天然气集团（海湾）公司于2018年4月4日向ToghiTrading-F.Z.C（以下简称Toghi公司）提供5,040,386美元用于资金拆借，当时Toghi公司是你控制的公司，上述行为构成关联方非经营性占用中曼石油资金，中曼石油亦未及时履行信息披露义务。2019年4月25日，你作为关联方股东先行替Toghi公司偿还上述借款的本金及利息合计5,386,860.75美元,折合人民币36,202,397.68元。 中曼石油的上述行为违反了《关于规范上市公司与关联方资金往来及上市公司对外担保若干问题的通知》（证监发[2003]56号）第一条、《上市公司治理准则》（证监发[2002]1号）第十四条、《上市公司信息披露管理办法》（证监会令第40号）第二条第一款、第三十条的有关规定。 你作为中曼石油董事长兼法定代表人、同时为Toghi公司的股东，在履职过程中未勤勉尽责，对此负有责任。你上述行为违反了《上市公司信息披露管理办法》第三条的规定。根据该办法第五十八条和第五十九条的规定，我局决定对你采取出具警示函的监管措施。 如果对本监督管理措施不服的，可以在收到本决定书之日起60日内向我会（中国证券监督管理委员会）提出行政复议申请，也可以在收到本决定书之日起6个月内向有管辖权的人民法院提起诉讼。复议与诉讼期间，上述监督管理措施不停止执行。 中国证券监督管理委员会上海监管局  2019年11月27日|2024-12-02 09:14:34
2019-11-27|上海局|bm56000001/2021-00201043|行政监管措施|关于对中曼石油天然气集团股份有限公司采取出具警示函措施的决定|沪证监决〔2019〕176号|中曼石油天然气集团股份有限公司： 经查，你公司全资子公司中曼石油天然气集团（海湾）公司于2018年4月4日向ToghiTrading-F.Z.C（以下简称Toghi公司）提供5,040,386美元用于资金拆借，当时Toghi公司是你公司董事长李春第控制的公司，上述行为构成关联方非经营性占用你公司资金，你公司亦未及时履行信息披露义务。2019年4月25日，李春第作为关联方股东先行替Toghi公司偿还上述借款的本金及利息合计5,386,860.75美元,折合人民币36,202,397.68元。 你公司的上述行为违反了《关于规范上市公司与关联方资金往来及上市公司对外担保若干问题的通知》（证监发[2003]56号）第一条、《上市公司治理准则》（证监发[2002]1号）第十四条、《上市公司信息披露管理办法》（证监会令第40号）第二条第一款、第三十条的有关规定。根据《上市公司信息披露管理办法》第五十九条的规定，我局决定对你公司采取出具警示函的行政监管措施。 如果对本监督管理措施不服的，可以在收到本决定书之日起60日内向我会（中国证券监督管理委员会）提出行政复议申请，也可以在收到本决定书之日起6个月内向有管辖权的人民法院提起诉讼。复议与诉讼期间，上述监督管理措施不停止执行。  中国证券监督管理委员会上海监管局 2019年11月27日|2024-12-02 09:14:34
