发文日期|来源|索引号|分类|名称|文号|内容|爬取时间
2024-05-11|重庆局|bm56000001/2024-00005182|行政监管措施|关于对南华期货股份有限公司重庆营业部采取出具警示函措施的决定||南华期货股份有限公司重庆营业部：经查，你营业部在王某立等4名交易者开立期货账户时，未严格执行南华期货股份有限公司《经纪业务风险控制管理制度》第二十七条、第二十八条规定，未向前述4名交易者告知账户实际控制关系认定标准，未向其询问是否与他人账户之间存在实际控制关系。上述情形反映出你营业部合规风险管理不到位，内部控制存在缺陷，违反了《期货公司监督管理办法》（证监会令第155号）第五十六条的规定。依据《期货公司监督管理办法》第一百零九条的规定，我局决定对你营业部采取出具警示函的行政监管措施，并记入证券期货市场诚信档案。你营业部应高度重视，认真整改，对相关人员进行内部问责，切实提高合规风险管理水平。如对本监督管理措施不服，可在收到本决定书之日起60日内向中国证券监督管理委员会提出行政复议申请，也可以在收到本决定书之日起6个月内向有管辖权的人民法院提起诉讼。复议与诉讼期间，上述监督管理措施不停止执行。重庆证监局2023年5月9日|2024-12-02 10:04:20
2024-05-11|重庆局|bm56000001/2024-00005180|行政监管措施|关于对五矿期货有限公司重庆营业部采取出具警示函措施的决定||五矿期货有限公司重庆营业部：经查，你营业部2名自然人客户接入了外部信息系统且存在异常交易行为。截至我局现场检查日，你营业部未对上述2名客户的异常交易行为进行监控，未有效排查风险并采取措施进行处理，未严格执行五矿期货有限公司《外部接入信息系统管理办法》第二十五条的规定。上述情形反映出你营业部合规风险管理不到位，内部控制存在缺陷，违反了《期货公司监督管理办法》（证监会令第155号）第五十六条的规定。依据《期货公司监督管理办法》第一百零九条的规定，我局决定对你营业部采取出具警示函的行政监管措施，并记入证券期货市场诚信档案。你营业部应高度重视，认真整改，对相关人员进行内部问责，切实提高合规风险管理水平。如对本监督管理措施不服，可在收到本决定书之日起60日内向中国证券监督管理委员会提出行政复议申请，也可以在收到本决定书之日起6个月内向有管辖权的人民法院提起诉讼。复议与诉讼期间，上述监督管理措施不停止执行。重庆证监局2024年5月9日|2024-12-02 10:04:20
2024-05-11|上海局|bm56000001/2024-00005586|行政监管措施|关于对朱前采取出具警示函措施的决定|沪证监决〔2024〕214号|朱前：经查，你任职的华泰证券（上海）资产管理有限公司（统一社会信用代码：91310000312590222J）在开展业务过程中存在以下问题：一是支持民营企业发展资产管理计划投向纾困用途的资金未达到规定比例，前述情况不符合《证券行业支持民营企业发展资产管理计划规范运作指引》（中证协发〔2022〕114号）第五条第二款的规定，反映出公司经营不够谨慎勤勉，违反了《证券期货经营机构私募资产管理业务管理办法》（证监会令第151号，以下简称2018年《私募资管办法》）第三条第一款和《证券期货经营机构私募资产管理业务管理办法》（证监会令第203号，以下简称2023年《私募资管办法》）第三条第一款的规定。二是对交易对手方尽职调查不充分，公司在为个别客户办理股票质押式回购业务的过程中，存在未对交易对手方进行审慎调查的情况。前述行为违反了2018年《私募资管办法》第六十一条第二款的相关规定。你作为分管相关业务的高级管理人员，对上述问题负有责任。根据2018年《私募资管办法》第七十八条和2023年《私募资管办法》第七十八条的规定，我局决定对你采取出具警示函的行政监管措施。如果对本行政监管措施不服，可以在收到本决定书之日起60日内向中国证券监督管理委员会提出行政复议申请，也可以在收到本决定书之日起6个月内向有管辖权的人民法院提起诉讼。复议与诉讼期间，上述行政监管措施不停止执行。中国证券监督管理委员会上海监管局2024年5月11日|2024-12-02 10:04:20
2024-05-11|上海局|bm56000001/2024-00005585|行政监管措施|关于对华泰证券（上海）资产管理有限公司采取出具警示函措施的决定|沪证监决〔2024〕213号|华泰证券（上海）资产管理有限公司：经查，你公司（华泰证券（上海）资产管理有限公司，统一社会信用代码：91310000312590222J）在开展业务过程中存在以下问题：一是支持民营企业发展资产管理计划投向纾困用途的资金未达到规定比例，前述情况不符合《证券行业支持民营企业发展资产管理计划规范运作指引》（中证协发〔2022〕114号）第五条第二款的规定，反映出你公司经营不够谨慎勤勉，违反了《证券期货经营机构私募资产管理业务管理办法》（证监会令第151号，以下简称2018年《私募资管办法》）第三条第一款和《证券期货经营机构私募资产管理业务管理办法》（证监会令第203号，以下简称2023年《私募资管办法》）第三条第一款的规定。二是对交易对手方尽职调查不充分，你公司在为个别客户办理股票质押式回购业务的过程中，存在未对交易对手方进行审慎调查的情况。前述行为违反了2018年《私募资管办法》第六十一条第二款的相关规定。根据2018年《私募资管办法》第七十八条和2023年《私募资管办法》第七十八条的规定，我局决定对你公司采取出具警示函的行政监管措施。如果对本行政监管措施不服，可以在收到本决定书之日起60日内向中国证券监督管理委员会提出行政复议申请，也可以在收到本决定书之日起6个月内向有管辖权的人民法院提起诉讼。复议与诉讼期间，上述行政监管措施不停止执行。中国证券监督管理委员会上海监管局2024年5月11日|2024-12-02 10:04:20
2024-05-11|上海局|bm56000001/2024-00005583|行政监管措施|关于对上海海通证券资产管理有限公司采取出具警示函措施的决定|沪证监决〔2024〕212号|上海海通证券资产管理有限公司：经查，你公司（上海海通证券资产管理有限公司,统一社会信用代码：91310000599711334G）在开展业务过程中存在以下问题：一是支持民营企业发展资产管理计划（以下简称纾困资管计划）投向纾困用途的资金未达到规定比例，纾困资管计划违规收取管理费，上述情况不符合《证券行业支持民营企业发展资产管理计划规范运作指引》（中证协发〔2022〕114号）第五条第二款和第三条第二款的规定，反映出你公司经营不够谨慎勤勉，未能有效遵循诚实信用原则，违反了《证券期货经营机构私募资产管理业务管理办法》（证监会令第151号，以下简称2018年《私募资管办法》）第三条第一款和《证券期货经营机构私募资产管理业务管理办法》（证监会令第203号，以下简称2023年《私募资管办法》）第三条第一款的规定。二是纾困资管计划管理不足，投资不审慎，未能有效防范和控制风险，违反了2018年《私募资管办法》第三条第二款和2023年《私募资管办法》第三条第二款的规定。根据2023年《私募资管办法》第七十八条的规定，我局决定对你公司采取出具警示函的行政监管措施。如果对本行政监管措施不服，可以在收到本决定书之日起60日内向中国证券监督管理委员会提出行政复议申请，也可以在收到本决定书之日起6个月内向有管辖权的人民法院提起诉讼。复议与诉讼期间，上述行政监管措施不停止执行。中国证券监督管理委员会上海监管局2024年5月11日|2024-12-02 10:04:20
2024-05-11|上海局|bm56000001/2024-00006066|行政监管措施|关于对宝龙地产控股有限公司采取出具警示函措施的决定|沪证监决〔2024〕215号|宝龙地产控股有限公司：经查，你公司存在以下问题：1.截至2018年11月末，公司当年累计新增借款较上年末增加64.86亿元，占上年末净资产的22.01%。截至2018年12月末，公司当年累计新增借款较上年末增加135.65亿元，占上年末净资产的46.02%。你公司于2019年4月30日发布公告予以披露，未在规定时限内披露。2.截至2020年12月末，公司当年累计新增借款较上年末增加113.04亿元，占上年末净资产的29.05%。你公司于2021年4月28日发布公告予以披露，未在规定时限内披露。上述行为不符合《公司债券临时报告信息披露格式指引第八号——发行人当年累计新增借款超过上年末净资产的百分之二十》（上证发〔2016〕79号）的规定，违反了《公司债券发行与交易管理办法》（证监会令第113号）第四十二条、第四十三条第二款的规定。根据《公司债券发行与交易管理办法》（证监会令第113号）第五十八条的规定，我局决定对你公司采取出具警示函的监管措施。你公司应自觉加强相关法律法规学习，进一步提高规范运作意识，认真履行信息披露义务。如对本监督管理措施不服，可以在收到本决定书之日起60日内向中国证券监督管理委员会提出行政复议申请，也可以在收到本决定书之日起6个月内向有管辖权的人民法院提起诉讼。复议与诉讼期间，上述监督管理措施不停止执行。中国证券监督管理委员会上海监管局2024年5月11日|2024-12-02 10:04:20
2024-05-11|上海局|bm56000001/2024-00006064|行政监管措施|关于对上海宝龙实业发展（集团）有限公司采取出具警示函措施的决定|沪证监决〔2024〕216号|上海宝龙实业发展（集团）有限公司：经查，你公司（统一社会信用代码：91310000550074354L）存在以下问题：1.你公司于2020年3月发行20宝龙02产品。某私募证券投资基金认购该产品的3000万元资金，最终来源于你公司的全资子公司上海瑞龙投资管理有限公司。你公司在发行结果公告中未如实披露上述重大事项。上述行为不符合《关于规范公司债券发行有关事项的通知》（深证上〔2019〕821号）第二条的规定，违反了《公司债券发行与交易管理办法》（证监会令第113号）第四十二条的规定。2.截至2018年12月末，公司当年累计新增借款较上年末增加93.77亿元，占上年末净资产的27.36%。你公司于2019年4月30日发布公告予以披露，未在规定时限内披露。上述行为不符合《公司债券临时报告信息披露格式指引第八号——发行人当年累计新增借款超过上年末净资产的百分之二十》（深证上〔2016〕941号）、《公司债券临时报告信息披露格式指引第八号——发行人当年累计新增借款超过上年末净资产的百分之二十》（上证发〔2016〕79号）的规定，违反了《公司债券发行与交易管理办法》（证监会令第113号）第四十二条、第四十五条第五项的规定。根据《公司债券发行与交易管理办法》（证监会令第113号）第五十八条的规定，我局决定对你公司采取出具警示函的监管措施。你公司应自觉加强相关法律法规学习，进一步提高规范运作意识，认真履行信息披露义务。如对本监督管理措施不服，可以在收到本决定书之日起60日内向中国证券监督管理委员会提出行政复议申请，也可以在收到本决定书之日起6个月内向有管辖权的人民法院提起诉讼。复议与诉讼期间，上述监督管理措施不停止执行。中国证券监督管理委员会上海监管局2024年5月11日|2024-12-02 10:04:20
2024-05-11|上海局|bm56000001/2024-00005418|行政监管措施|关于对蔡金娜采取出具警示函措施的决定|沪证监决〔2024〕211号|蔡金娜：经查，你作为上海美迪西生物医药股份有限公司（以下简称公司）的董事、副总经理，你的配偶陈敏武于2022年1月12日买入公司股票3000股，2022年1月13日卖出公司股票3000股，买卖行为前后间隔期不足6个月。上述行为构成《中华人民共和国证券法》第四十四条第一款、第二款规定的短线交易行为。为维护市场秩序，规制违规交易行为，根据《中华人民共和国证券法》第一百七十条第二款的规定，我局决定对你采取出具警示函的行政监管措施。如果对本监督管理措施不服，可以在收到本决定书之日起60日内向中国证券监督管理委员会提出行政复议申请，也可以在收到本决定书之日起6个月内向有管辖权的人民法院提起诉讼。复议与诉讼期间，上述监督管理措施不停止执行。中国证券监督管理委员会上海监管局2024年5月11日|2024-12-02 10:04:20
