发文日期|来源|索引号|分类|名称|文号|内容|爬取时间
2024-04-15||bm56000001/2024-00003964|行政监管措施|关于对王玮华采取出具警示函措施的决定|沪证监决〔2024〕158号|王玮华：经查，爱普香料集团股份有限公司（以下简称“公司”）存在以下问题：1.公司控股子公司上海盟泽商贸有限公司（以下简称“盟泽商贸”）存在偷逃税款行为，公司于2023年4月27日披露会计差错更正及追溯调整的公告，将偷逃税额根据各年偷逃情况调整以前年度损益，并因偷逃税款对未来现金流的影响调整以前年度商誉减值损失。盟泽商贸偷逃税款行为导致公司2018年至2020年归属于母公司股东的净利润分别多计61.71万元、3,624.55万元、99.85万元，分别占原披露金额的0.56%、23.88%、0.59%；2021年归属于母公司股东的净利润少计1,394.11万元，占原披露金额的7.39%。公司未能有效管理并控制控股子公司，确保其依法合规经营，导致2018年至2021年年报披露的财务数据不准确，影响投资者知情权。公司上述行为违反了《上市公司信息披露管理办法》（证监会令第40号）第二条第一款、《上市公司信息披露管理办法》（证监会令第182号）第三条第一款的规定。2.对于盟泽商贸偷逃税款判决相关情况，公司在2023年2月23日披露的《关于控股子公司收到起诉书和传票的公告》中表示“判决生效后存在导致公司需要调整以前年度损益的可能…亦可能对公司2022年度或未来的净利润产生不确定性影响”，在3月25日披露的《关于控股子公司收到法院判决书的公告》中表示“公司暂无法预计本判决对公司以前年度、本期及未来利润的影响”，但在4月11日披露的《关于控股子公司一审判决生效的公告》中仅表示“一审判决结果生效，公司将按照相关会计准则进行会计处理，对公司本期利润不会产生重大影响，亦不会对公司生产经营情况造成重大影响”，未提示对以前年度利润的影响，相关信息披露不准确。公司上述行为违反了《上市公司信息披露管理办法》（证监会令第182号）第三条第一款的规定。你作为公司时任董事会秘书，对公司2023年4月11日披露的《关于控股子公司一审判决生效的公告》未提示对以前年度利润的影响，相关信息披露不准确的行为负有责任，违反了《上市公司信息披露管理办法》（证监会令第182号）第四条、第五十一条第一款、第二款的规定。根据《上市公司信息披露管理办法》（证监会令第182号）第五十二条第三项的规定，我局决定对你采取出具警示函的监督管理措施。如果对本监督管理措施不服，可以在收到本决定书之日起60日内向中国证券监督管理委员会提出行政复议申请，也可以在收到本决定书之日起6个月内向有管辖权的人民法院提起诉讼。复议和诉讼期间，上述监督管理措施不停止执行。中国证券监督管理委员会上海监管局2024年4月15日|2024-12-02 08:57:24
2024-04-15||bm56000001/2024-00003963|行政监管措施|关于对冯林霞采取出具警示函措施的决定|沪证监决〔2024〕150号|冯林霞：经查，爱普香料集团股份有限公司（以下简称“公司”）存在以下问题：公司控股子公司上海盟泽商贸有限公司（以下简称“盟泽商贸”）存在偷逃税款行为，公司于2023年4月27日披露会计差错更正及追溯调整的公告，将偷逃税额根据各年偷逃情况调整以前年度损益，并因偷逃税款对未来现金流的影响调整以前年度商誉减值损失。盟泽商贸偷逃税款行为导致公司2018年至2020年归属于母公司股东的净利润分别多计61.71万元、3,624.55万元、99.85万元，分别占原披露金额的0.56%、23.88%、0.59%；2021年归属于母公司股东的净利润少计1,394.11万元，占原披露金额的7.39%。公司未能有效管理并控制控股子公司，确保其依法合规经营，导致2018年至2021年年报披露的财务数据不准确，影响投资者知情权。公司上述行为违反了《上市公司信息披露管理办法》（证监会令第40号）第二条第一款、《上市公司信息披露管理办法》（证监会令第182号）第三条第一款的规定。你作为公司时任财务总监，对公司上述行为负有责任，违反了《上市公司信息披露管理办法》（证监会令第40号）第三条、第五十八条第一款、第三款、《上市公司信息披露管理办法》（证监会令第182号）第四条、第五十一条第一款、第三款的规定。根据《上市公司信息披露管理办法》（证监会令第182号）第五十二条第三项的规定，我局决定对你采取出具警示函的监督管理措施。如果对本监督管理措施不服，可以在收到本决定书之日起60日内向中国证券监督管理委员会提出行政复议申请，也可以在收到本决定书之日起6个月内向有管辖权的人民法院提起诉讼。复议和诉讼期间，上述监督管理措施不停止执行。中国证券监督管理委员会上海监管局2024年4月15日|2024-12-02 08:57:24
2024-04-15||bm56000001/2024-00003962|行政监管措施|关于对魏中浩采取出具警示函措施的决定|沪证监决〔2024〕152号|魏中浩：经查，爱普香料集团股份有限公司（以下简称“公司”）存在以下问题：1.公司控股子公司上海盟泽商贸有限公司（以下简称“盟泽商贸”）存在偷逃税款行为，公司于2023年4月27日披露会计差错更正及追溯调整的公告，将偷逃税额根据各年偷逃情况调整以前年度损益，并因偷逃税款对未来现金流的影响调整以前年度商誉减值损失。盟泽商贸偷逃税款行为导致公司2018年至2020年归属于母公司股东的净利润分别多计61.71万元、3,624.55万元、99.85万元，分别占原披露金额的0.56%、23.88%、0.59%；2021年归属于母公司股东的净利润少计1,394.11万元，占原披露金额的7.39%。公司未能有效管理并控制控股子公司，确保其依法合规经营，导致2018年至2021年年报披露的财务数据不准确，影响投资者知情权。公司上述行为违反了《上市公司信息披露管理办法》（证监会令第40号）第二条第一款、《上市公司信息披露管理办法》（证监会令第182号）第三条第一款的规定。2.对于盟泽商贸偷逃税款判决相关情况，公司在2023年2月23日披露的《关于控股子公司收到起诉书和传票的公告》中表示“判决生效后存在导致公司需要调整以前年度损益的可能…亦可能对公司2022年度或未来的净利润产生不确定性影响”，在3月25日披露的《关于控股子公司收到法院判决书的公告》中表示“公司暂无法预计本判决对公司以前年度、本期及未来利润的影响”，但在4月11日披露的《关于控股子公司一审判决生效的公告》中仅表示“一审判决结果生效，公司将按照相关会计准则进行会计处理，对公司本期利润不会产生重大影响，亦不会对公司生产经营情况造成重大影响”，未提示对以前年度利润的影响，相关信息披露不准确。公司上述行为违反了《上市公司信息披露管理办法》（证监会令第182号）第三条第一款的规定。你作为公司时任董事长、总经理，对公司上述行为负有责任，违反了《上市公司信息披露管理办法》（证监会令第40号）第三条、第五十八条、《上市公司信息披露管理办法》（证监会令第182号）第四条、第五十一条的规定。根据《上市公司信息披露管理办法》（证监会令第182号）第五十二条第三项的规定，我局决定对你采取出具警示函的监督管理措施。如果对本监督管理措施不服，可以在收到本决定书之日起60日内向中国证券监督管理委员会提出行政复议申请，也可以在收到本决定书之日起6个月内向有管辖权的人民法院提起诉讼。复议和诉讼期间，上述监督管理措施不停止执行。中国证券监督管理委员会上海监管局2024年4月15日|2024-12-02 08:57:24
2024-04-15||bm56000001/2024-00003960|行政监管措施|关于对杨希采取出具警示函措施的决定|沪证监决〔2024〕148号|杨希：经查，上海嘉麟杰纺织品股份有限公司（统一社会信用代码：913100006074274061，以下简称公司）存在以下事实：一、对外捐赠1.未针对对外捐赠事项建立严格的审查和决策程序。公司2022年-2023年存在多笔对外捐赠，主要由子公司作为对外捐赠主体，子公司未书面向公司董事会汇报捐赠事项，公司未建立捐赠制度对子公司公益性捐赠和非公益性捐赠予以规范，不符合《上市公司章程指引》（2022年修订，证监会公告〔2022〕2号）第一百一十条的规定。2.公司部分对外捐赠事项构成为他人承担费用，未履行董事会审议程序。公司子公司于2022年12月为第三方承担20万元费用，未履行董事会审议程序，不符合《深圳证券交易所上市公司自律监管指引第1号——主板上市公司规范运作》（深圳上〔2022〕13号）第6.1.8条第二项、第6.1.3条第一款的规定。二、薪酬披露及审议1.未准确披露董事、高管薪酬。公司子公司为部分董事、高管购买年金保险，未在2020年-2022年报中披露，不符合《公开发行证券的公司信息披露内容与格式准则第2号——年度报告的内容与格式》（证监会公告〔2017〕17号）第五十五条第一款第三项、《公开发行证券的公司信息披露内容与格式准则第2号——年度报告的内容与格式》（证监会公告〔2021〕15号）第三十一条第三项关于年度报酬披露的规定，违反了《上市公司信息披露管理办法》（证监会令第182号）第三条第一款的规定。2.审议董事薪酬议案时，相关董事未回避表决。公司在2022年4月、2023年4月召开董事会审议《关于公司董事薪酬的议案》时，对2021年报、2022年报披露的董事薪酬进行审议和确认，相关董事均未回避表决，不符合《上市公司治理准则》（证监会公告〔2018〕29号）第六十条第一款的规定。3.部分高管薪酬未经董事会审议。公司于2022年4月、2023年4月召开董事会，均对《关于公司高级管理人员薪酬的议案》进行审议，议案以2021年、2022年年度报告中披露的高管薪酬为主要内容，对2021年、2022年的高管薪酬进行审议并确认。因公司部分高管的年金保险在年报中未披露，导致议案内容不完整、不准确，构成高管薪酬未经董事会审议的情形，不符合《上市公司治理准则》（证监会公告〔2018〕29号）第六十条第二款的规定。4.部分董事薪酬未经股东大会审议。公司于2022年5月、2023年5月召开2021年、2022年年度股东大会，均对《关于公司董事薪酬的议案》进行审议，议案以2021年、2022年年度报告中披露的董事薪酬主要内容，对2021年、2022年的董事薪酬进行审议并确认。因部分董事的年金保险未在年报中披露，导致议案内容不完整、不准确，构成公司部分董事的年金保险未经股东大会审议的情况，不符合《上市公司治理准则》（证监会公告〔2018〕29号）第六十条第一款的规定。三、长期股权投资核算公司未将境外被投资企业适用准则与公司适用准则认定为会计政策差异，未对长期股权投资进行调整，导致2022年年报长期股权投资科目累计错报3,521万元，占2022年经审计净资产总额的比例为3.38%，不符合《企业会计准则第2号——长期股权投资》（财会〔2014〕14号）第十一条第三款的规定，违反了《上市公司信息披露管理办法》（证监会令第182号）第三条第一款的规定。你作为公司董事长，未能勤勉尽责，对公司上述行为负有责任，违反了《上市公司信息披露管理办法》第四条的规定。为促进上市公司规范运作，根据《证券法》第一百七十条第二款、《上市公司信息披露管理办法》第五十一条、第五十二条第三项的规定，我局决定对你采取出具警示函的行政监管措施。如果对本监督管理措施不服，可以在收到本决定书之日起60日内向中国证券监督管理委员会提出行政复议申请，也可以在收到本决定书之日起6个月内向有管辖权的人民法院提起诉讼。复议与诉讼期间，上述监督管理措施不停止执行。中国证券监督管理委员会上海监管局2024年4月15日|2024-12-02 08:57:24
2024-04-15||bm56000001/2024-00003957|行政监管措施|关于对曾冠钧采取出具警示函措施的决定|沪证监决〔2024〕149号|曾冠钧：经查，上海嘉麟杰纺织品股份有限公司（统一社会信用代码：913100006074274061，以下简称公司）存在以下事实：一、对外捐赠1.未针对对外捐赠事项建立严格的审查和决策程序。公司2022年-2023年存在多笔对外捐赠，主要由子公司作为对外捐赠主体，子公司未书面向公司董事会汇报捐赠事项，公司未建立捐赠制度对子公司公益性捐赠和非公益性捐赠予以规范，不符合《上市公司章程指引》（2022年修订，证监会公告〔2022〕2号）第一百一十条的规定。2.公司部分对外捐赠事项构成为他人承担费用，未履行董事会审议程序。公司子公司于2022年12月为第三方承担20万元费用，未履行董事会审议程序，不符合《深圳证券交易所上市公司自律监管指引第1号——主板上市公司规范运作》（深圳上〔2022〕13号）第6.1.8条第二项、第6.1.3条第一款的规定。二、薪酬披露及审议1.未准确披露董事、高管薪酬。公司子公司为部分董事、高管购买年金保险，未在2020年-2022年报中披露，不符合《公开发行证券的公司信息披露内容与格式准则第2号——年度报告的内容与格式》（证监会公告〔2017〕17号）第五十五条第一款第三项、《公开发行证券的公司信息披露内容与格式准则第2号——年度报告的内容与格式》（证监会公告〔2021〕15号）第三十一条第三项关于年度报酬披露的规定，违反了《上市公司信息披露管理办法》（证监会令第182号）第三条第一款的规定。2.审议董事薪酬议案时，相关董事未回避表决。公司在2022年4月、2023年4月召开董事会审议《关于公司董事薪酬的议案》时，对2021年报、2022年报披露的董事薪酬进行审议和确认，相关董事均未回避表决，不符合《上市公司治理准则》（证监会公告〔2018〕29号）第六十条第一款的规定。3.部分高管薪酬未经董事会审议。公司于2022年4月、2023年4月召开董事会，均对《关于公司高级管理人员薪酬的议案》进行审议，议案以2021年、2022年年度报告中披露的高管薪酬为主要内容，对2021年、2022年的高管薪酬进行审议并确认。因公司部分高管的年金保险在年报中未披露，导致议案内容不完整、不准确，构成高管薪酬未经董事会审议的情形，不符合《上市公司治理准则》（证监会公告〔2018〕29号）第六十条第二款的规定。4.部分董事薪酬未经股东大会审议。公司于2022年5月、2023年5月召开2021年、2022年年度股东大会，均对《关于公司董事薪酬的议案》进行审议，议案以2021年、2022年年度报告中披露的董事薪酬主要内容，对2021年、2022年的董事薪酬进行审议并确认。因部分董事的年金保险未在年报中披露，导致议案内容不完整、不准确，构成公司部分董事的年金保险未经股东大会审议的情况，不符合《上市公司治理准则》（证监会公告〔2018〕29号）第六十条第一款的规定。三、长期股权投资核算公司未将境外被投资企业适用准则与公司适用准则认定为会计政策差异，未对长期股权投资进行调整，导致2022年年报长期股权投资科目累计错报3,521万元，占2022年经审计净资产总额的比例为3.38%，不符合《企业会计准则第2号——长期股权投资》（财会〔2014〕14号）第十一条第三款的规定，违反了《上市公司信息披露管理办法》（证监会令第182号）第三条第一款的规定。你作为公司总经理、董事会秘书，未能勤勉尽责，对公司上述行为负有责任，违反了《上市公司信息披露管理办法》第四条的规定。为促进上市公司规范运作，根据《证券法》第一百七十条第二款、《上市公司信息披露管理办法》第五十一条、第五十二条第三项的规定，我局决定对你采取出具警示函的行政监管措施。如果对本监督管理措施不服，可以在收到本决定书之日起60日内向中国证券监督管理委员会提出行政复议申请，也可以在收到本决定书之日起6个月内向有管辖权的人民法院提起诉讼。复议与诉讼期间，上述监督管理措施不停止执行。中国证券监督管理委员会上海监管局2024年4月15日|2024-12-02 08:57:24
2024-04-15||bm56000001/2024-00005006|行政监管措施|关于对上海中期期货股份有限公司采取出具警示函监管措施的决定|沪证监决〔2024〕155号|上海中期期货股份有限公司：经查，你单位（统一社会信用代码：9131000063032857XL）存在以下违规行为：2024年1月27日，你单位在生产系统上进行相关业务模拟测试，存在重大操作失误，致使公司证券现货资金总额发生重大差额预警，反映出你公司在内部控制方面存在不足，违反了《期货公司监督管理办法》(证监会令第155号）第五十六条的规定。根据《期货公司监督管理办法》第一百零九条，我局决定对你单位采取出具警示函的监督管理措施。如果对本监督管理措施不服，可以在收到本决定书之日起60日内向中国证券监督管理委员会提出行政复议申请，也可以在收到本决定书之日起6个月内向有管辖权的人民法院提起诉讼。复议与诉讼期间，上述监督管理措施不停止执行。中国证券监督管理委员会上海监管局2024年4月15日|2024-12-02 08:57:24
2024-04-15||bm56000001/2024-00004124|行政监管措施|关于对孙贵银采取出具警示函措施的决定|沪证监决〔2024〕154号|孙贵银：经查，你在华闻期货有限公司任职期间，存在以下违规事实：不符合期货交易咨询从业条件但向交易者提供期货交易咨询建议，违反了《期货公司期货交易咨询业务办法》（证监会令第70号，经证监会令第202号修改）第三条第二款的规定。上述行为违反了《期货从业人员管理办法》（证监会令第48号）第十五条第三项的规定，根据《期货从业人员管理办法》第二十九条的规定，现决定对你采取出具警示函的监督管理措施。如果对本监督管理措施不服的，可以在收到本决定书之日起60日内向中国证券监督管理委员会提出行政复议申请，也可以在收到本决定书之日起6个月内向有管辖权的人民法院提起诉讼。复议与诉讼期间，上述监督管理措施不停止执行。中国证券监督管理委员会上海监管局2024年4月15日|2024-12-02 08:57:24
2024-04-15||bm56000001/2024-00004123|行政监管措施|关于对华闻期货有限公司采取责令改正措施的决定|沪证监决〔2024〕153号|华闻期货有限公司：近期，我局在对你公司（统一社会信用代码：913100001000223382）的核查中发现，你公司存在不符合期货交易咨询从业条件的员工发布期货交易咨询建议，营销留痕不完整，对员工营销活动合规管控不足的情况，违反了《期货公司监督管理办法》（证监会令第155号）第五十六条的规定。根据《期货公司监督管理办法》第一百零九条的规定，现决定对你公司采取责令改正的监督管理措施。你公司应在收到本决定书之日起1个月内予以改正并提交书面报告。如果对本监督管理措施不服，可以在收到本决定书之日起60日内向中国证券监督管理委员会提出行政复议申请，也可以在收到本决定书之日起6个月内向有管辖权的人民法院提起诉讼。复议与诉讼期间，上述监督管理措施不停止执行。中国证券监督管理委员会上海监管局2024年4月15日|2024-12-02 08:57:24
2024-04-15||bm56000001/2024-00003825|行政监管措施|关于对段智瑞采取责令改正措施的决定|沪证监决〔2024〕147号|段智瑞：经查，截至2023年4月20日，你作为上海龙韵文创科技集团股份有限公司（以下简称龙韵股份或公司）股东，持有公司股份3,895,300股，占公司总股本的4.17%，与公司股东许龙为一致行动人，合计持有公司股份5,337,300股，占公司总股本的5.72%。2023年10月31日至11月8日，你与许龙合计减持公司股份1,289,300股，占公司总股本的1.38%。其中，许龙于2023年10月31日至11月7日，通过集中竞价方式合计减持龙韵股份933,300股，占公司总股本的0.99%。你于2023年11月8日通过集中竞价方式减持公司股份356,000股，占公司总股本0.38%，导致你与一致行动人在3个月内通过集中竞价合计减持股份超过公司股份总数的1%，上述行为不符合《上市公司股东、董监高减持股份的若干规定》（证监会公告〔2017〕9号）第九条第一款、第二款的规定，违反了《中华人民共和国证券法》第三十六条第二款的相关规定。为维护市场秩序，规制违规交易行为，根据《中华人民共和国证券法》第一百七十条第二款的规定，我局决定对你采取责令改正的监管措施。你应当认真吸取教训，积极采取措施，消除违法行为影响，切实加强对证券法律法规的学习，杜绝此类违法违规行为再次发生，并自收到本决定书之日起三十个工作日内向我局提交书面整改报告。如对本监督管理措施不服，可以在收到本决定书之日起60日内向中国证券监督管理委员会提出行政复议申请，也可以在收到本决定书之日起6个月内向有管辖权的人民法院提起诉讼。复议与诉讼期间，上述监督管理措施不停止执行。中国证券监督管理委员会上海监管局2024年4月15日|2024-12-02 08:57:24
