发文日期|来源|索引号|分类|名称|文号|内容|爬取时间
2023-06-25||bm56000001/2023-00007150|行政监管措施|关于对郭荣宽采取出具警示函和监管谈话措施的决定||郭荣宽：经查，我局发现重庆锦瑜电子股份有限公司（统一社会信用代码：91500226563499386R，以下简称锦瑜股份或公司，原名重庆凯歌电子股份有限公司）存在以下违规行为：一、未按照规定披露信息（一）未披露实际控制人权益变动信息公司2019年半年报披露郭荣宽、古朝菊、古恩瑜（曾用名郭莉莎）、郭毓楠系公司实际控制人，截至2019年6月底，罗辉先、夏毅勤持股分别增加784.6万股、778.2万股，系公司第4、第5大股东，持股比例分别为9.6%、9.49%，且披露“郭荣宽与古朝菊系夫妻关系，郭荣宽与郭莉莎父女关系，古朝菊与郭莉莎母女关系，其他股东间不存在关联关系”。经查，公司未披露郭荣宽、古恩瑜通过罗辉先、夏毅勤证券账户增持公司股票的权益变动情况。（二）股票被司法冻结的信息披露不及时你持有的6,644,437股锦瑜股份股票被司法冻结，占公司总股本9.23%。该司法冻结期限为2021年5月26日起至2024年5月25日止。该事项于2021年7月12日补充披露，信息披露不及时。（三）未披露与实际控制人共同借款的信息2019年6月28日、2019年7月2日、2019年10月16日，公司、郭荣宽、古朝菊、古恩瑜、郭毓楠等人与自然人苏某签署《借款合同》，分别借款2000万元、2000万元、1600万元，公司未对上述借款履行相关审议程序，且未披露。二、关联方非经营性占用公司资金2019年7月3日，公司经由供应商银行账户向重庆沃劲商贸有限公司合计转移公司资金2000万元，用于归还公司、郭荣宽、古朝菊、古恩瑜、郭毓楠等人的共同借款，构成资金占用。其中，1645万元于2019年归还公司，355万元尚未归还。2019年4月16日至2019年4月17日，公司经由供应商等银行账户向夏毅勤证券账户转移公司资金400万元、向古恩瑜银行账户转移公司资金341万元、向郭荣宽银行账户转移公司资金157.4万元，金额合计898.4万元，用于支付你收购重庆荣新环保产业股权投资基金合伙企业（有限合伙）持有的公司股票相关款项，构成资金占用，直到2019年8月才归还公司。三、变更会计师事务所程序不规范2021年6月18日，公司董事会审议通过《关于变更会计师事务所的议案》，拟聘请尤尼泰振青会计师事务所为公司2020年年报审计机构。2021年6月30日，公司披露了经尤尼泰振青会计师事务所审计并出具的审计报告。2021年7月8日，公司股东大会审议通过《关于变更会计师事务所的议案》。公司在未召开股东大会审议变更会计师事务所议案的情况下，披露了由拟聘请的会计师事务所出具的审计报告，相关决策程序不规范。锦瑜股份上述行为，违反了《非上市公众公司监督管理办法》（证监会令第161号）第十条、第二十一条，《非上市公众公司监督管理办法》（证监会令第212号）第十四条、第二十一条，《非上市公众公司收购管理办法》（证监会令第166号）第十三条的相关规定。2019年1月至11月，你担任公司董事长、总经理，任职期间未能忠实、勤勉地履行职责，占用公司资金，未能保证公司披露信息的真实、准确、完整、及时。你的上述行为不符合《非上市公众公司监督管理办法》（证监会令第161号）第十四条、第二十一条，《非上市公众公司监督管理办法》（证监会令第212号）第十四条、第二十一条，《非上市公众公司收购管理办法》（证监会令第166号）第十三条的相关规定。根据《非上市公众公司监督管理办法》（证监会令第161号）第八十三条、《非上市公众公司监督管理办法》（证监会令第212号）第七十二条、《非上市公众公司收购管理办法》（证监会令第166号）第三十七条的相关规定，我局决定对你采取出具警示函和监管谈话的监管措施，并将相关情况记入证券期货市场诚信档案。现要求你于2023年7月11日携带有效身份证件到我局接受监管谈话。如果对本监督管理措施不服，可以在收到本决定书之日起60日内向中国证券监督管理委员会提出行政复议申请，也可以在收到本决定书之日起6个月内向有管辖权的人民法院提起诉讼。复议与诉讼期间，上述监督管理措施不停止执行。重庆证监局2023年6月21日|2024-12-02 08:57:23
2023-06-25||bm56000001/2023-00007149|行政监管措施|关于对古恩瑜采取出具警示函和监管谈话措施的决定||古恩瑜：经查，我局发现重庆锦瑜电子股份有限公司（统一社会信用代码：91500226563499386R，以下简称锦瑜股份或公司，原名重庆凯歌电子股份有限公司）存在以下违规行为：一、未按照规定披露信息（一）未披露实际控制人权益变动信息公司2019年半年报披露郭荣宽、古朝菊、古恩瑜（曾用名郭莉莎）、郭毓楠系公司实际控制人，截至2019年6月底，罗辉先、夏毅勤持股分别增加784.6万股、778.2万股，系公司第4、第5大股东，持股比例分别为9.6%、9.49%，且披露“郭荣宽与古朝菊系夫妻关系，郭荣宽与郭莉莎父女关系，古朝菊与郭莉莎母女关系，其他股东间不存在关联关系”。经查，公司未披露郭荣宽、古恩瑜通过罗辉先、夏毅勤证券账户增持公司股票的权益变动情况。（二）股票被司法冻结的信息披露不及时郭荣宽持有的6,644,437股锦瑜股份股票被司法冻结，占公司总股本9.23%。该司法冻结期限为2021年5月26日起至2024年5月25日止。该事项于2021年7月12日补充披露，信息披露不及时。（三）未披露与实际控制人共同借款的信息2019年6月28日、2019年7月2日、2019年10月16日，公司、郭荣宽、古朝菊、古恩瑜、郭毓楠等人与自然人苏某签署《借款合同》，分别借款2000万元、2000万元、1600万元，公司未对上述借款履行相关审议程序，且未披露。二、关联方非经营性占用公司资金2019年7月3日，公司经由供应商银行账户向重庆沃劲商贸有限公司合计转移公司资金2000万元，用于归还公司、郭荣宽、古朝菊、古恩瑜、郭毓楠等人的共同借款，构成资金占用。其中，1645万元于2019年归还公司，355万元尚未归还。2019年4月16日至2019年4月17日，公司经由供应商等银行账户向夏毅勤证券账户转移公司资金400万元、向古恩瑜银行账户转移公司资金341万元、向郭荣宽银行账户转移公司资金157.4万元，金额合计898.4万元，用于支付郭荣宽收购重庆荣新环保产业股权投资基金合伙企业（有限合伙）持有的公司股票相关款项，构成资金占用，直到2019年8月才归还公司。三、变更会计师事务所程序不规范2021年6月18日，公司董事会审议通过《关于变更会计师事务所的议案》，拟聘请尤尼泰振青会计师事务所为公司2020年年报审计机构。2021年6月30日，公司披露了经尤尼泰振青会计师事务所审计并出具的审计报告。2021年7月8日，公司股东大会审议通过《关于变更会计师事务所的议案》。公司在未召开股东大会审议变更会计师事务所议案的情况下，披露了由拟聘请的会计师事务所出具的审计报告，相关决策程序不规范。锦瑜股份上述行为，违反了《非上市公众公司监督管理办法》（证监会令第161号）第十条、第二十一条，《非上市公众公司监督管理办法》（证监会令第212号）第十四条、第二十一条，《非上市公众公司收购管理办法》（证监会令第166号）第十三条的相关规定。2019年1月至11月，你担任公司董事、董事会秘书，2019年12月至2023年3月，你担任公司董事长、总经理、董事会秘书，任职期间未能忠实、勤勉地履行职责，占用公司资金，未能保证公司披露信息的真实、准确、完整、及时。你的上述行为不符合《非上市公众公司监督管理办法》（证监会令第161号）第十四条、第二十一条，《非上市公众公司监督管理办法》（证监会令第212号）第十四条、第二十一条，《非上市公众公司收购管理办法》（证监会令第166号）第十三条的相关规定。根据《非上市公众公司监督管理办法》（证监会令第161号）第八十三条、《非上市公众公司监督管理办法》（证监会令第212号）第七十二条、《非上市公众公司收购管理办法》（证监会令第166号）第三十七条的相关规定，我局决定对你采取出具警示函和监管谈话的监管措施，并将相关情况记入证券期货市场诚信档案。现要求你于2023年7月12日携带有效身份证件到我局接受监管谈话。如果对本监督管理措施不服，可以在收到本决定书之日起60日内向中国证券监督管理委员会提出行政复议申请，也可以在收到本决定书之日起6个月内向有管辖权的人民法院提起诉讼。复议与诉讼期间，上述监督管理措施不停止执行。重庆证监局2023年6月21日|2024-12-02 08:57:23
2023-06-25||bm56000001/2023-00007148|行政监管措施|关于对重庆锦瑜电子股份有限公司采取责令改正措施的决定||重庆锦瑜电子股份有限公司：经查，我局发现你公司（统一社会信用代码：91500226563499386R，原名重庆凯歌电子股份有限公司）存在以下违规行为。一、未按照规定披露信息（一）未披露实际控制人权益变动信息你公司2019年半年报披露郭荣宽、古朝菊、古恩瑜（曾用名郭莉莎）、郭毓楠系你公司实际控制人，截至2019年6月底，罗辉先、夏毅勤持股分别增加784.6万股、778.2万股，系你公司第4、第5大股东，持股比例分别为9.6%、9.49%，且披露“郭荣宽与古朝菊系夫妻关系，郭荣宽与郭莉莎父女关系，古朝菊与郭莉莎母女关系，其他股东间不存在关联关系”。经查，你公司未披露郭荣宽、古恩瑜通过罗辉先、夏毅勤证券账户增持你公司股票的权益变动情况。（二）股票被司法冻结的信息披露不及时你公司股东郭荣宽持有的6,644,437股份被司法冻结，占公司总股本9.23%。该司法冻结期限为2021年5月26日起至2024年5月25日止。该事项于2021年7月12日补充披露，信息披露不及时。（三）未披露与实际控制人共同借款的信息2019年6月28日、2019年7月2日、2019年10月16日，你公司、郭荣宽、古朝菊、古恩瑜、郭毓楠等人与自然人苏某签署《借款合同》，分别借款2000万元、2000万元、1600万元，你公司未对上述借款履行相关审议程序，且未披露。二、关联方非经营性占用公司资金2019年7月3日，你公司经由供应商银行账户向重庆沃劲商贸有限公司合计转移公司资金2000万元，用于归还你公司、郭荣宽、古朝菊、古恩瑜、郭毓楠等人的共同借款，构成资金占用。其中，1645万元于2019年归还你公司，355万元尚未归还。2019年4月16日至2019年4月17日，你公司经由供应商等银行账户向夏毅勤证券账户转移公司资金400万元、向古恩瑜银行账户转移公司资金341万元、向郭荣宽银行账户转移公司资金157.4万元，金额合计898.4万元，用于支付郭荣宽收购重庆荣新环保产业股权投资基金合伙企业（有限合伙）持有的公司股票相关款项，构成资金占用，直到2019年8月才归还你公司。三、变更会计师事务所程序不规范2021年6月18日，你公司董事会审议通过《关于变更会计师事务所的议案》，拟聘请尤尼泰振青会计师事务所为公司2020年年报审计机构。2021年6月30日，你公司披露了经尤尼泰振青会计师事务所审计并出具的审计报告。2021年7月8日，你公司股东大会审议通过《关于变更会计师事务所的议案》。你公司在未召开股东大会审议变更会计师事务所议案的情况下，披露了由拟聘请的会计师事务所出具的审计报告，相关决策程序不规范。上述行为违反了《非上市公众公司监督管理办法》（证监会令第161号）第十条、第二十一条，《非上市公众公司监督管理办法》（证监会令第212号）第十四条、第二十一条，《非上市公众公司收购管理办法》（证监会令第166号）第十三条的相关规定。根据《非上市公众公司监督管理办法》（证监会令第212号）第六十五条、《非上市公众公司监督管理办法》（证监会令第161号）第七十七条、《非上市公众公司收购管理办法》（证监会令第166号）第三十七条的相关规定，我局决定对你公司采取责令改正的监管措施，责令你公司立即进行整改并达到如下要求：一是立即补充披露实际控制人相关权益变动情况。二是立即对公司实际控制人占用公司资金的情况开展全面自查、清理，根据自查结果真实、准确、完整地披露实际控制人资金占用情况及具体整改方案，并对涉及的相关定期报告进行更正披露。三是限期收回被占用的资金。你公司应于2023年7月20日前收回被实际控制人占用的资金及相应的资金占用利息。四是对有关人员进行严肃问责，进一步加强和规范公司治理、财务内控，严格杜绝实际控制人及其关联方占用公司资金的行为，切实保护公司、股东、债权人及其他利益相关人的合法权益。五是强化培训教育，提高规范运作水平。你公司应认真汲取教训，以实际控制人及全体董事、监事、高管人员为重点，切实加强对证券法律法规的学习和培训，进一步强化规范运作意识，切实提高规范运作水平，确保真实、准确、完整、及时、公平地履行信息披露义务。你公司收到本决定书后应按有关规定及时予以披露，并自收到本决定书之日起30日内向我局提交书面整改报告并披露。你公司整改报告应包括整改措施、整改完成时间、整改责任人、内部问责及长效机制的建立情况等内容。该报告应由你公司全体董事、监事、高管人员签名确认，并加盖你公司公章。我局将视你公司自查和整改情况考虑是否采取进一步监管措施。如果对本监督管理措施不服，可以在收到本决定书之日起60日内向中国证券监督管理委员会提出行政复议申请，也可以在收到本决定书之日起6个月内向有管辖权的人民法院提起诉讼。复议与诉讼期间，上述监督管理措施不停止执行。重庆证监局2023年6月21日|2024-12-02 08:57:23
2023-06-25||bm56000001/2023-00007125|行政监管措施|关于对艾纯、杜春辉采取监管谈话行政监管措施的决定||艾纯、杜春辉：经查，神驰机电股份有限公司（以下简称神驰机电或公司）与关联方重庆五谷通用设备有限公司2021年关联交易累计金额为997.87万元，但公司未及时进行审议和披露，直至2023年4月24日董事会才进行补充审议，并于4月25日进行补充披露。公司上述行为违反了《上市公司信息披露管理办法》（证监会令第182号，简称《信披办法》）第三条和第四十一条的规定。艾纯作为公司董事长兼总经理、杜春辉作为公司董事会秘书，对上述违规行为负主要责任。根据《信披办法》第五十二条的规定，我局决定对你们采取监管谈话行政监管措施，并记入证券期货市场诚信档案。现要求你们于2023年6月30日携带有效身份证件到我局接受监管谈话。如果对本监督管理措施不服的，可以在收到本决定书之日起60日内向中国证券监督管理委员会提出行政复议申请，也可以在收到本决定书之日起6个月内向有管辖权的人民法院提起诉讼。复议与诉讼期间，上述监督管理措施不停止执行。重庆证监局2023年6月19日|2024-12-02 08:57:23
2023-06-25||bm56000001/2023-00007124|行政监管措施|关于对神驰机电股份有限公司采取出具警示函措施的决定||神驰机电股份有限公司：经查，你公司与关联方重庆五谷通用设备有限公司2021年关联交易累计金额为997.87万元，但你公司未及时进行审议和披露，直至2023年4月24日董事会才进行补充审议，并于4月25日进行补充披露。你公司上述行为违反了《上市公司信息披露管理办法》（证监会令第182号，简称《信披办法》）第三条和第四十一条的规定。根据《信披办法》第五十二条的规定，我局决定对你公司采取出具警示函的行政监管措施，并记入证券期货市场诚信档案。如果对本监督管理措施不服的，可以在收到本决定书之日起60日内向中国证券监督管理委员会提出行政复议申请，也可以在收到本决定书之日起6个月内向有管辖权的人民法院提起诉讼。复议与诉讼期间，上述监督管理措施不停止执行。重庆证监局2023年6月19日|2024-12-02 08:57:23
