发文日期|来源|索引号|分类|名称|文号|内容|爬取时间
2024-05-16|上海局|bm56000001/2024-00006673|行政监管措施|关于对国信证券股份有限公司上海东长治路证券营业部采取出具警示函措施的决定|沪证监决〔2024〕225号|国信证券股份有限公司上海东长治路证券营业部:经查，你营业部在与第三方互联网平台开展合作过程中，存在报酬支付与新开户数量、客户资产值、佣金等直接挂钩的情形。上述问题反映出你营业部内部控制不完善、合规管理不到位，不符合《关于加强证券经纪业务管理的规定》（证监会公告〔2010〕11号）第二条的规定，违反了《证券经纪业务管理办法》（证监会令第204号）第三条第一项、《证券公司和证券投资基金管理公司合规管理办法》（证监会令第133号，经证监会令第166号修正，以下简称《合规管理办法》）第三条的规定。根据《证券经纪业务管理办法》第四十三条、《合规管理办法》第三十二条第一款的规定，我局决定对你营业部采取出具警示函的行政监管措施。如果对本监督管理措施不服，可以在收到本决定书之日起60日内向中国证券监督管理委员会提出行政复议申请，也可以在收到本决定书之日起6个月内向有管辖权的人民法院提起诉讼。复议与诉讼期间，上述监督管理措施不停止执行。中国证券监督管理委员会上海监管局2024年5月16日|2024-12-02 09:14:33
2024-05-16|上海局|bm56000001/2024-00006672|行政监管措施|关于对国信证券股份有限公司上海分公司采取出具警示函措施的决定|沪证监决〔2024〕224号|国信证券股份有限公司上海分公司:经查，你分公司在与第三方互联网平台开展合作过程中，存在报酬支付与新开户数量、客户资产值、佣金等直接挂钩的情形。上述问题反映出你分公司内部控制不完善、合规管理不到位，不符合《关于加强证券经纪业务管理的规定》（证监会公告〔2010〕11号）第二条的规定，违反了《证券公司和证券投资基金管理公司合规管理办法》（证监会令第133号，经证监会令第166号修正，以下简称《合规管理办法》）第三条的规定。根据《合规管理办法》第三十二条第一款的规定，我局决定对你分公司采取出具警示函的行政监管措施。如果对本监督管理措施不服，可以在收到本决定书之日起60日内向中国证券监督管理委员会提出行政复议申请，也可以在收到本决定书之日起6个月内向有管辖权的人民法院提起诉讼。复议与诉讼期间，上述监督管理措施不停止执行。中国证券监督管理委员会上海监管局2024年5月16日|2024-12-02 09:14:33
2024-05-16|上海局|bm56000001/2024-00006671|行政监管措施|关于对陶正斌采取出具警示函措施的决定|沪证监决〔2024〕226号|陶正斌：经查，我局发现国信证券股份有限公司上海分公司（以下简称“分公司”）、国信证券股份有限公司上海东长治路证券营业部（以下简称“营业部”）在与第三方互联网平台开展合作过程中，存在报酬支付与新开户数量、客户资产值、佣金等直接挂钩的情形，不符合《关于加强证券经纪业务管理的规定》（证监会公告〔2010〕11号）第二条的规定，违反了《证券经纪业务管理办法》（证监会令第204号）第三条第一项、《证券公司和证券投资基金管理公司合规管理办法》（证监会令第133号，经证监会令第166号修正，以下简称《合规管理办法》）第三条的规定。你作为时任分公司副总经理、营业部负责人，对上述违规行为负有责任。根据《证券经纪业务管理办法》第四十三条、《合规管理办法》第三十二条第一款规定，我局决定对你采取出具警示函的行政监管措施。如果对本监督管理措施不服，可以在收到本决定书之日起60日内向中国证券监督管理委员会提出行政复议申请，也可以在收到本决定书之日起6个月内向有管辖权的人民法院提起诉讼。复议与诉讼期间，上述监督管理措施不停止执行。中国证券监督管理委员会上海监管局2024年5月16日|2024-12-02 09:14:33
2024-05-16|上海局|bm56000001/2024-00006670|行政监管措施|关于对谭萌佳采取出具警示函措施的决定|沪证监决〔2024〕227号|谭萌佳：经查，我局发现国信证券股份有限公司上海东长治路证券营业部（以下简称“营业部”）在与第三方互联网平台开展合作过程中，存在报酬支付与新开户数量、客户资产值、佣金等直接挂钩的情形，不符合《关于加强证券经纪业务管理的规定》（证监会公告〔2010〕11号）第二条的规定，违反了《证券经纪业务管理办法》（证监会令第204号）第三条第一项、《证券公司和证券投资基金管理公司合规管理办法》（证监会令第133号，经证监会令第166号修正，以下简称《合规管理办法》）第三条的规定。你作为时任营业部网络金融部总经理，对上述违规行为负有责任。根据《证券经纪业务管理办法》第四十三条、《合规管理办法》第三十二条第一款规定，我局决定对你采取出具警示函的行政监管措施。如果对本监督管理措施不服，可以在收到本决定书之日起60日内向中国证券监督管理委员会提出行政复议申请，也可以在收到本决定书之日起6个月内向有管辖权的人民法院提起诉讼。复议与诉讼期间，上述监督管理措施不停止执行。中国证券监督管理委员会上海监管局2024年5月16日|2024-12-02 09:14:33
2024-05-16|上海局|bm56000001/2024-00005947|行政监管措施|关于对毛志森采取出具警示函措施的决定|沪证监决〔2024〕223号|毛志森：经查，你作为上海兰卫医学检验所股份有限公司（简称“公司”）董事以及副总经理，于2024年3月21日买入公司股票16,300股，成交金额23.71万元，于2024年3月26日卖出公司股票9,000股，成交金额10.63万元,且未按规定进行披露。上述行为不符合《上市公司股东、董监高减持股份的若干规定》（证监会公告〔2017〕9号）第八条第一款、《上市公司董事、监事和高级管理人员所持本公司股份及其变动管理规则》（证监会公告〔2022〕19号）第七条第一款、第十一条的规定，违反了《中华人民共和国证券法》第三十六条第二款、第四十四条第一款的规定。为维护市场秩序，规制违规交易行为，根据《中华人民共和国证券法》第一百七十条第二款的规定，我局决定对你采取出具警示函的行政监管措施。如果对本监督管理措施不服，可以在收到本决定书之日起60日内向中国证券监督管理委员会提出行政复议申请，也可以在收到本决定书之日起6个月内向有管辖权的人民法院提起诉讼。复议与诉讼期间，上述监督管理措施不停止执行。中国证券监督管理委员会上海监管局2024年5月16日|2024-12-02 09:14:33
2024-05-16|上海局|bm56000001/2024-00005884|行政监管措施|关于对张忠山采取出具警示函措施的决定|沪证监决〔2024〕222号|张忠山：经查，你在担任山西三立期货经纪有限公司上海分公司（以下简称“上海分公司”)负责人期间，上海分公司存在部分营销宣传用语具有误导性表述、部分无期货交易咨询业务资格的从业人员向交易者提供交易建议、部分无期货交易咨询业务资格的从业人员通过互联网开展期货行情分析等信息传播活动并对部分品种走势进行分析预测等问题，反映出上海分公司风险管理不到位，内部控制存在缺陷，违反了《期货公司监督管理办法》（证监会令第155号）第五十六条的规定。你作为上海分公司负责人，未切实履行职责，对上述问题负有管理责任，违反了《期货公司董事、监事和高级管理人员任职管理办法》（证监会令第47号，经证监会令第179号、202号修改）第四条的规定。根据《期货公司董事、监事和高级管理人员任职管理办法》第二条第三款、第四十四条第一项的规定，我局决定对你采取出具警示函的监督管理措施。你应认真对照相关法律法规，分析公司违规问题产生的原因，切实履行管理职责。如果对本监督管理措施不服，可以在收到本决定书之日起60日内向中国证券监督管理委员会提出行政复议申请，也可以在收到本决定书之日起6个月内向有管辖权的人民法院提起诉讼。复议与诉讼期间，上述监管措施不停止执行。中国证券监督管理委员会上海监管局2024年5月16日|2024-12-02 09:14:33
2024-05-16|上海局|bm56000001/2024-00005883|行政监管措施|关于对山西三立期货经纪有限公司上海分公司采取责令改正监管措施的决定|沪证监决〔2024〕221号|山西三立期货经纪有限公司上海分公司：经查，你单位（统一社会信用代码：91310115MA1K47E4X2）存在以下违规行为：一是部分营销宣传用语存在误导性表述;二是部分无期货交易咨询业务资格的从业人员向交易者提供交易咨询建议;三是部分无期货交易咨询业务资格的从业人员通过互联网开展期货行情分析等信息传播活动并对部分品种走势进行分析预测。上述行为反映出你单位风险管理不到位，内部控制存在缺陷，违反了《期货公司监督管理办法》（证监会令第155号）第五十六条的规定。根据《期货公司监督管理办法》第一百零九条的规定，我局决定对你单位采取责令改正的监督管理措施，你单位应在收到本决定书之日起1个月内予以改正并提交书面报告。如果对本监督管理措施不服，可以在收到本决定书之日起60日内向中国证券监督管理委员会提出行政复议申请，也可以在收到本决定书之日起6个月内向有管辖权的人民法院提起诉讼。复议与诉讼期间，上述监管措施不停止执行。中国证券监督管理委员会上海监管局2024年5月16日|2024-12-02 09:14:33
