发文日期|来源|索引号|分类|名称|文号|内容|爬取时间
2024-02-18||bm56000001/2024-00002108|行政监管措施|关于对中航证券有限公司采取出具警示函措施的决定|沪证监决〔2024〕60号|中航证券有限公司：你公司作为天海融合防务装备技术股份有限公司（简称天海防务或公司）2016年重大资产重组的独立财务顾问，于2018年4月出具的《中航证券有限公司关于公司发行股份及支付现金购买资产并募集配套资金暨关联交易之2017年度持续督导报告暨持续督导总结报告》（简称《持续督导报告暨总结报告》）中载明“经核查，独立财务顾问认为：……公司发展情况良好，标的资产实现了业绩承诺，业务发展符合预期。”经查，2016年3月至2017年12月，上述标的资产泰州市金海运船用设备有限责任公司（简称金海运）通过虚构相关游乐设施贸易业务，虚增2017年营业收入6,144.32万元，虚增营业成本2,197.89万元，导致天海防务2017年年报虚增利润总额3,946.44万元，占天海防务2017年年报利润总额（21,728.41万元）的18.16%。2023年9月，公司对金海运业绩承诺实现情况进行更正，更正后金海运未完成业绩承诺。你公司在从事该项财务顾问业务的持续督导工作中未勤勉尽责，未充分履行核查义务，制作、出具的《持续督导报告暨总结报告》存在不实记载，违反了《上市公司重大资产重组管理办法》（证监会令第127号）第六条第一款的规定。根据《上市公司重大资产重组管理办法》第五十八条第一款的规定，我局决定对你公司采取出具警示函的监管措施。如果对本监督管理措施不服，可以在收到本决定书之日起60日内向中国证券监督管理委员会提出行政复议申请，也可以在收到本决定书之日起6个月内向有管辖权的人民法院提起诉讼。复议与诉讼期间，上述监督管理措施不停止执行。中国证券监督管理委员会上海监管局2024年2月18日|2024-12-02 08:57:24
2024-02-18||bm56000001/2024-00002067|行政监管措施|关于对远东资信评估有限公司采取出具警示函措施的决定|沪证监决〔2024〕65号|远东资信评估有限公司:经查，你公司(统一社会信用代码91310101132508092K)在信息披露、评级项目质量控制方面存在以下问题：一、你公司于2020年12月披露《资产支持证券与公司债券的评级标准差异的说明》，后续未按照公司2022年修订并披露的资产证券化产品以及公司信用类债券信用评级方法做相应修订并披露。上述情况违反了《证券市场资信评级业务管理办法》（证监会令第181号）第四十条第二款的规定。二、个别公司债券评级项目评级报告中相关数据与打分表不一致。上述情形违反了《证券市场资信评级业务管理办法》(证监会令第181号)第五条的规定。三、个别公司债券评级项目尽职调查程序不到位。上述情形违反了《证券市场资信评级业务管理办法》(证监会令第181号)第五条、第十八条第一款的规定。根据《证券市场资信评级业务管理办法》第四十七条第一款的规定,现对你公司采取出具警示函的监管措施。你公司应提升信息披露质量，强化风险控制意识，完善并有效落实评级项目质量控制制度。如果对本监督管理措施不服,可以在收到本决定书之日起60日内向中国证券监督管理委员会提出行政复议申请,也可以在收到本决定书之日起6个月内向有管辖权的人民法院提起诉讼。复议与诉讼期间,上述监督管理措施不停止执行。中国证券监督管理委员会上海监管局2024年2月18日|2024-12-02 08:57:24
2024-02-18||bm56000001/2024-00001974|行政监管措施|关于对蔡丹采取出具警示函措施的决定|沪证监决〔2024〕64号|蔡丹:经查，上海海希工业通讯股份有限公司（统一社会信用代码：913100007034810073，以下简称公司）存在以下事实：2023年9月8日，公司控股子公司希姆科技（上海）有限公司（简称“希姆科技”）与中冶宝钢技术服务有限公司（简称“中冶宝钢”）签订《建设工程施工合同》，约定中冶宝钢作为希姆科技生产基地及辅助用房建设项目的承包商，合同总金额14,597.73万元，占公司最近一期经审计总资产的17.85%。公司实际控制人、时任董事长LITONG担任中冶宝钢董事，上述事项构成关联交易。公司直至2023年11月20日、12月12日才分别召开董事会、股东会进行审议，并于2023年11月22日补充披露。公司未及时审议和披露关联交易，不符合《北京证券交易所股票上市规则（试行）》（北证公告〔2023〕49号）第7.2.5条、第7.2.6条的规定，违反了《上市公司信息披露管理办法》（证监会令第182号）第三条第一款、第二十二条第一款、第二款第一项、第二十六条第一款、第四十一条、《中华人民共和国证券法》第八十条第二款第三项的规定，你作为公司时任财务总监，未能勤勉履行职责，对公司上述行为负有主要责任，违反了《上市公司信息披露管理办法》第四条的规定。依据《上市公司信息披露管理办法》第五十一条第一款、第五十二条第三项的规定，我局决定对你采取出具警示函的行政监督管理措施。如果对本监督管理措施不服，可以在收到本决定书之日起60日内向中国证券监督管理委员会提出行政复议申请，也可以在收到本决定书之日起6个月内向有管辖权的人民法院提起诉讼。复议与诉讼期间，上述监督管理措施不停止执行。中国证券监督管理委员会上海监管局2024年2月18日|2024-12-02 08:57:24
2024-02-18||bm56000001/2024-00001973|行政监管措施|关于对郑晓宇采取出具警示函措施的决定|沪证监决〔2024〕63号|郑晓宇:经查，上海海希工业通讯股份有限公司（统一社会信用代码：913100007034810073，以下简称公司）存在以下事实：2023年9月8日，公司控股子公司希姆科技（上海）有限公司（简称“希姆科技”）与中冶宝钢技术服务有限公司（简称“中冶宝钢”）签订《建设工程施工合同》，约定中冶宝钢作为希姆科技生产基地及辅助用房建设项目的承包商，合同总金额14,597.73万元，占公司最近一期经审计总资产的17.85%。公司实际控制人、时任董事长LITONG担任中冶宝钢董事，上述事项构成关联交易。公司直至2023年11月20日、12月12日才分别召开董事会、股东会进行审议，并于2023年11月22日补充披露。公司未及时审议和披露关联交易，不符合《北京证券交易所股票上市规则（试行）》（北证公告〔2023〕49号）第7.2.5条、第7.2.6条的规定，违反了《上市公司信息披露管理办法》（证监会令第182号）第三条第一款、第二十二条第一款、第二款第一项、第二十六条第一款、第四十一条、《中华人民共和国证券法》第八十条第二款第三项的规定，你作为公司时任董事会秘书，未能勤勉履行职责，对公司上述行为负有主要责任，违反了《上市公司信息披露管理办法》第四条的规定。依据《上市公司信息披露管理办法》第五十一条第一款、第二款、第五十二条第三项的规定，我局决定对你采取出具警示函的行政监督管理措施。如果对本监督管理措施不服，可以在收到本决定书之日起60日内向中国证券监督管理委员会提出行政复议申请，也可以在收到本决定书之日起6个月内向有管辖权的人民法院提起诉讼。复议与诉讼期间，上述监督管理措施不停止执行。中国证券监督管理委员会上海监管局2024年2月18日|2024-12-02 08:57:24
2024-02-18||bm56000001/2024-00001972|行政监管措施|关于对LI TONG采取出具警示函措施的决定|沪证监决〔2024〕62号|LITONG:经查，上海海希工业通讯股份有限公司（统一社会信用代码：913100007034810073，以下简称公司）存在以下事实：2023年9月8日，公司控股子公司希姆科技（上海）有限公司（简称“希姆科技”）与中冶宝钢技术服务有限公司（简称“中冶宝钢”）签订《建设工程施工合同》，约定中冶宝钢作为希姆科技生产基地及辅助用房建设项目的承包商，合同总金额14,597.73万元，占公司最近一期经审计总资产的17.85%。你作为公司实际控制人、时任董事长，亦担任中冶宝钢董事，上述事项构成关联交易。公司直至2023年11月20日、12月12日才分别召开董事会、股东会进行审议，并于2023年11月22日补充披露。公司未及时审议和披露关联交易，不符合《北京证券交易所股票上市规则（试行）》（北证公告〔2023〕49号）第7.2.5条、第7.2.6条的规定，违反了《上市公司信息披露管理办法》（证监会令第182号）第三条第一款、第二十二条第一款、第二款第一项、第二十六条第一款、第四十一条、《中华人民共和国证券法》第八十条第二款第三项的规定，你作为公司时任董事长兼总经理，未能勤勉履行职责，对公司上述行为负有主要责任，违反了《上市公司信息披露管理办法》第四条的规定。依据《上市公司信息披露管理办法》第五十一条第一款、第二款、第五十二条第三项的规定，我局决定对你采取出具警示函的行政监督管理措施。如果对本监督管理措施不服，可以在收到本决定书之日起60日内向中国证券监督管理委员会提出行政复议申请，也可以在收到本决定书之日起6个月内向有管辖权的人民法院提起诉讼。复议与诉讼期间，上述监督管理措施不停止执行。中国证券监督管理委员会上海监管局2024年2月18日|2024-12-02 08:57:24
2024-02-18||bm56000001/2024-00001971|行政监管措施|关于对上海海希工业通讯股份有限公司采取出具警示函措施的决定|沪证监决〔2024〕61号|上海海希工业通讯股份有限公司：经查，你公司（统一社会信用代码：913100007034810073）存在以下事实：2023年9月8日，你公司控股子公司希姆科技（上海）有限公司（简称“希姆科技”）与中冶宝钢技术服务有限公司（简称“中冶宝钢”）签订《建设工程施工合同》，约定中冶宝钢作为希姆科技生产基地及辅助用房建设项目的承包商，合同总金额14,597.73万元，占你公司最近一期经审计总资产的17.85%。你公司实际控制人、时任董事长LITONG担任中冶宝钢董事，上述事项构成关联交易。你公司直至2023年11月20日、12月12日才分别召开董事会、股东会进行审议，并于2023年11月22日补充披露。你公司未及时审议和披露关联交易，不符合《北京证券交易所股票上市规则（试行）》（北证公告〔2023〕49号）第7.2.5条、第7.2.6条的规定，违反了《上市公司信息披露管理办法》（证监会令第182号）第三条第一款、第二十二条第一款、第二款第一项、第二十六条第一款、第四十一条、《中华人民共和国证券法》第八十条第二款第三项的规定。依据《上市公司信息披露管理办法》第五十二条第三项的规定，我局决定对你公司采取出具警示函的行政监管措施。如果对本监督管理措施不服，可以在收到本决定书之日起60日内向中国证券监督管理委员会提出行政复议申请，也可以在收到本决定书之日起6个月内向有管辖权的人民法院提起诉讼。复议与诉讼期间，上述监督管理措施不停止执行。中国证券监督管理委员会上海监管局2024年2月18日|2024-12-02 08:57:24
2024-02-18||bm56000001/2024-00002161|行政监管措施|关于对上海长甲投资有限公司采取责令改正措施的决定|沪证监决〔2024〕66号|上海长甲投资有限公司：经查，你公司（统一社会信用代码：913101157878476261）于2023年10月18日至11月7日期间通过集合竞价交易减持上海新南洋昂立教育科技股份有限公司（以下简称“昂立教育”或公司）股份3,008,800股，占公司总股本的1.05%，减持前你公司及一致行动人合计持股比例超过5%，上述行为不符合《上市公司股东、董监高减持股份的若干规定》（证监会公告〔2017〕9号）第九条第一款的规定，违反了《中华人民共和国证券法》第三十六条第二款的相关规定。为维护市场秩序，规制违规交易行为，根据《中华人民共和国证券法》第一百七十条第二款的规定，我局决定对你公司采取责令改正的行政监管措施。你公司应引以为戒，切实加强证券法律法规学习，严格规范交易行为，杜绝此类违规行为再次发生，于收到本决定书之日起三十日内整改完毕并向我局提交整改报告。如果对本监督管理措施不服，可以在收到本决定书之日起60日内向中国证券监督管理委员会提出行政复议申请，也可以在收到本决定书之日起6个月内向有管辖权的人民法院提起诉讼。复议与诉讼期间，上述监督管理措施不停止执行。中国证券监督管理委员会上海监管局2024年2月18日|2024-12-02 08:57:24
