发文日期|来源|索引号|分类|名称|文号|内容|爬取时间
2023-12-25|上海局|bm56000001/2023-00014622|行政监管措施|关于对胡佳佳采取出具警示函措施的决定|沪证监决[2023]370号|胡佳佳：经查，上海美邦服饰股份有限公司（简称公司，统一社会信用代码：913100001321787408）于2018年5月起至2019年12月为资金压力较大的新加盟商提供财务资助,用于支付其店铺租金和装修投入，日最高余额为2.28亿元。截至2023年9月30日未收回余额为4,399.85万元。公司上述对外提供财务资助的行为未履行审议程序并及时披露，直到2023年7月4日才以临时公告的形式予以披露。公司上述行为不符合《深圳证券交易所中小企业板上市公司规范运作指引（2015年修订）》第7.4.3条的规定，违反了《上市公司信息披露管理办法》（证监会令第40号）第二条第一款、第三十条第一款的相关规定。你自2016年11月30日至今任公司董事长、总裁，对公司上述事项负有主要责任，违反了《上市公司信息披露管理办法》第三条的规定。根据《上市公司信息披露管理办法》第五十八条第一款和第二款、第五十九条第三项的规定，现对你采取出具警示函的行政监管措施。如果对本监督管理措施不服，可以在收到本决定书之日起60日内向中国证券监督管理委员会提出行政复议申请，也可以在收到本决定书之日起6个月内向有管辖权的人民法院提起诉讼。复议与诉讼期间，上述监督管理措施不停止执行。中国证券监督管理委员会上海监管局2023年12月25日|2024-12-02 10:04:21
2023-12-25|上海局|bm56000001/2023-00014621|行政监管措施|关于对上海美邦服饰股份有限公司采取出具警示函措施的决定|沪证监决[2023]369号|上海美邦服饰股份有限公司：经查，你公司（统一社会信用代码：913100001321787408）于2018年5月起至2019年12月为资金压力较大的新加盟商提供财务资助,用于支付其店铺租金和装修投入，日最高余额为2.28亿元，占发生时公司最近一期经审计净资产的8.14%。截至2023年9月30日未收回余额为4,399.85万元。公司上述对外提供财务资助的行为未履行审议程序并及时披露，直到2023年7月4日才以临时公告的形式予以披露。你公司上述行为不符合《深圳证券交易所中小企业板上市公司规范运作指引（2015年修订）》第7.4.3条的规定，违反了《上市公司信息披露管理办法》（证监会令第40号）第二条第一款、第三十条第一款的相关规定。根据《上市公司信息披露管理办法》第五十九条第三项的规定，现对你公司采取出具警示函的行政监管措施。如果对本监督管理措施不服，可以在收到本决定书之日起60日内向中国证券监督管理委员会提出行政复议申请，也可以在收到本决定书之日起6个月内向有管辖权的人民法院提起诉讼。复议与诉讼期间，上述监督管理措施不停止执行。中国证券监督管理委员会上海监管局2023年12月25日|2024-12-02 10:04:21
2023-12-25|上海局|bm56000001/2023-00014564|行政监管措施|关于对陈雄采取出具警示函措施的决定|沪证监决〔2023〕368号|陈雄：经查，上海雪榕生物科技股份有限公司（统一社会信用代码：91310000607382324Y，以下简称公司）2020-2022年对全资子公司威宁香榕生物科技有限公司资产组的减值测试中存在计算错误、预测方法不恰当导致减值测试不准确，不符合《企业会计准则第8号——资产减值》的相关规定，导致相应年度定期报告披露的财务数据不准确。上述行为违反了《上市公司信息披露管理办法》（证监会令第40号）第二条第一款和《上市公司信息披露管理办法》（证监会令第182号）第三条第一款的规定。你自2018年8月至2022年4月任公司财务总监，履职过程中未勤勉尽责，对公司上述事项负有责任，违反了《上市公司信息披露管理办法》（证监会令第40号）第三条、《上市公司信息披露管理办法》（证监会令第182号）第四条的规定。根据《上市公司信息披露管理办法》（证监会令第40号）第五十八条第一款及第三款、第五十九条第三项和《上市公司信息披露管理办法》（证监会令第182号）第五十一条第一款及第三款、第五十二条第三项规定，我局决定对你采取出具警示函的监督管理措施。如果对本监督管理措施不服，可以在收到本决定书之日起60日内向中国证券监督管理委员会提出行政复议申请，也可以在收到本决定书之日起6个月内向有管辖权的人民法院提起诉讼。复议与诉讼期间，上述监督管理措施不停止执行。中国证券监督管理委员会上海监管局2023年12月25日|2024-12-02 10:04:21
2023-12-25|上海局|bm56000001/2023-00014563|行政监管措施|关于对杨勇萍采取出具警示函措施的决定|沪证监决〔2023〕367号|杨勇萍：经查，上海雪榕生物科技股份有限公司（统一社会信用代码：91310000607382324Y，以下简称公司）2020-2022年对全资子公司威宁香榕生物科技有限公司资产组的减值测试中存在计算错误、预测方法不恰当导致减值测试不准确，不符合《企业会计准则第8号——资产减值》的相关规定，导致相应年度定期报告披露的财务数据不准确。上述行为违反了《上市公司信息披露管理办法》（证监会令第40号）第二条第一款和《上市公司信息披露管理办法》（证监会令第182号）第三条第一款的规定。你自2014年8月至今任公司董事长，自2022年4月至今兼任公司总经理并主管会计工作，履职过程中未勤勉尽责，对公司上述事项负有责任，违反了《上市公司信息披露管理办法》（证监会令第40号）第三条、《上市公司信息披露管理办法》（证监会令第182号）第四条的规定。根据《上市公司信息披露管理办法》（证监会令第40号）第五十八条第一款及第三款、第五十九条第三项和《上市公司信息披露管理办法》（证监会令第182号）第五十一条第一款及第三款、第五十二条第三项规定，我局决定对你采取出具警示函的监督管理措施。如果对本监督管理措施不服，可以在收到本决定书之日起60日内向中国证券监督管理委员会提出行政复议申请，也可以在收到本决定书之日起6个月内向有管辖权的人民法院提起诉讼。复议与诉讼期间，上述监督管理措施不停止执行。中国证券监督管理委员会上海监管局2023年12月25日|2024-12-02 10:04:21
2023-12-25|上海局|bm56000001/2023-00014561|行政监管措施|关于对上海雪榕生物科技股份有限公司采取责令改正措施的决定|沪证监决〔2023〕366号|上海雪榕生物科技股份有限公司：经查，你公司（统一社会信用代码：91310000607382324Y）2020-2022年对全资子公司威宁香榕生物科技有限公司资产组的减值测试中存在计算错误、预测方法不恰当导致减值测试不准确，不符合《企业会计准则第8号——资产减值》的相关规定，导致相应年度定期报告披露的财务数据不准确。上述行为违反了《上市公司信息披露管理办法》（证监会令第40号）第二条第一款和《上市公司信息披露管理办法》（证监会令第182号）第三条第一款的规定。根据《上市公司信息披露管理办法》（证监会令第40号）第五十九条第一项、《上市公司信息披露管理办法》（证监会令第182号）第五十二条第一项的规定，我局决定对你公司采取责令改正的监督管理措施。你公司应采取有效措施切实整改，提升信息披露质量，并于收到本决定书之日起30日内向我局提交书面整改报告。如果对本监督管理措施不服，可以在收到本决定书之日起60日内向中国证券监督管理委员会提出行政复议申请，也可以在收到本决定书之日起6个月内向有管辖权的人民法院提起诉讼。复议与诉讼期间，上述监督管理措施不停止执行。中国证券监督管理委员会上海监管局2023年12月25日|2024-12-02 10:04:21
