发文日期|来源|索引号|分类|名称|文号|内容|爬取时间
2023-12-19||bm56000001/2023-00014515|行政监管措施|关于对翁记泉采取出具警示函措施的决定|沪证监决〔2023〕358号|翁记泉：经查，天海融合防务装备技术股份有限公司（统一社会信用代码：9131000072942385X3，以下简称公司）存在以下事实：1.关联交易披露不准确。2022年11月11日、2023年1月30日，公司子公司上海沃金天然气利用有限公司（简称“沃金天然气”）与厦门太威商贸有限公司（简称“太威商贸”）签订《焦炭买卖合同》，向太威商贸采购焦炭，合同金额总计20,070万元。经查，太威商贸将沃金天然气”支付的采购款于同日直接或间接划转至钦实（厦门）贸易有限公司（简称“钦实集团”），沃金天然气”向太威商贸采购的焦炭实际为向钦实集团采购，钦实集团为公司实际控制人何旭东控制的企业，上述交易构成关联交易。公司在2022年年度报告里披露对太威商贸的预付款为2,000万元；于2023年4月21日在《关于2023年日常关联交易计划的公告》中披露2022年全年、2023年以来截至披露日，公司向钦实集团采购商品或劳务的交易金额均为0。公司在上述临时报告、定期报告中，未准确披露前述关联交易实质和金额，违反了《上市公司信息披露管理办法》第三条第一款的规定。你作为公司副总经理，未能勤勉尽责，对公司上述行为负有责任，违反了《上市公司信息披露管理办法》第四条的规定。依据《上市公司信息披露管理办法》第五十一条、第五十二条第三项的规定，我局决定对你采取出具警示函的行政监管措施。如果对本监督管理措施不服，可以在收到本决定书之日起60日内向中国证券监督管理委员会提出行政复议申请，也可以在收到本决定书之日起6个月内向有管辖权的人民法院提起诉讼。复议与诉讼期间，上述监督管理措施不停止执行。中国证券监督管理委员会上海监管局2023年12月19日|2024-12-02 08:57:24
2023-12-19||bm56000001/2023-00014514|行政监管措施|关于对何旭东采取出具警示函措施的决定|沪证监决〔2023〕357号|何旭东：经查，天海融合防务装备技术股份有限公司（统一社会信用代码：9131000072942385X3，以下简称公司）存在以下事实：1.未按规定及时披露对子公司的担保。公司分别于2021年11月12日、11月24日、11月26日出具《不可撤销的担保书》、于2022年3月28日出具《履约保函》，约定对子公司江苏大津重工有限公司（简称“大津重工”）应向船东或出口代理方承担的债务、义务和责任承担不可撤销的连带责任，所涉担保本金合计人民币349,356,800元，公司在股东大会审议时预计了担保额度，但未在担保事项实际发生时及时披露。公司分别于2022年3月28日、7月27日签订保证合同，约定为子公司大津重工、江苏佳美海洋工程装备有限公司向银行的借款提供连带保证责任担保，所涉担保债权余额分别为12,000万元、200万元，但公司分别于2022年4月20日、8月26日才补充披露。前述行为不符合《关于规范上市公司对外担保行为的通知》（证监发〔2005〕120号）第一条第五项、《上市公司监管指引第8号--上市公司资金往来、对外担保的监管要求》（证监会公告〔2022〕26号）第十二条的规定，违反了《上市公司信息披露管理办法》（证监会令第182号）第三条第一款、第二十二条第一款、第二款第一项、《中华人民共和国证券法》第八十条第二款第三项的规定。2.关联交易披露不准确。2022年11月11日、2023年1月30日，公司子公司上海沃金天然气利用有限公司（简称“沃金天然气”）与厦门太威商贸有限公司（简称“太威商贸”）签订《焦炭买卖合同》，向太威商贸采购焦炭，合同金额总计20,070万元。经查，太威商贸将沃金天然气支付的采购款于同日直接或间接划转至钦实（厦门）贸易有限公司（简称“钦实集团”），沃金利用向太威商贸采购的焦炭实际为向钦实集团采购，钦实集团为公司实际控制人何旭东控制的企业，上述交易构成关联交易。公司在2022年年度报告里披露对太威商贸的预付款为2,000万元；于2023年4月21日在《关于2023年日常关联交易计划的公告》中披露2022年全年、2023年以来截至披露日，公司向钦实集团采购商品或劳务的交易金额均为0。公司在上述临时报告、定期报告中，未准确披露前述关联交易实质和金额，违反了《上市公司信息披露管理办法》第三条第一款的规定。3.公司在2022年年报中对大宗贸易焦炭业务按净额法核算，但2021年年报、2022年半年报和季度报告中仍按总额法核算，导致相关营业收入、营业成本确认不准确，不符合《企业会计准则第14号--收入》（财会〔2017〕22号）第三十四条的规定，违反了《上市公司信息披露管理办法》第三条第一款的规定。4.2022年报中对H&CMARINEENGINEERING(SINGAPORE)PTE.LTD（简称“H&C”）坏账准备转回的会计处理不准确。公司将应收H&C的合同价款计入主营业务收入和应收账款、将合同价款与现销价格的差异计入坏账准备核算。公司未按规定以现销价格确定主营业务收入，亦未通过未实现融资收益等科目进行会计核算，不符合《企业会计准则第14号--收入》应用指南（2018）的相关规定，违反了《上市公司信息披露管理办法》第三条第一款的规定。5.公司2022年年报中前五大客户、供应商相关信息披露不准确，违反了《上市公司信息披露管理办法》第三条第一款的规定。6.未按规定及时披露政府补助。公司子公司泰州市金海运船用设备有限责任公司分别于2022年2月10日、9月2日收到与收益相关的政府补助349万元、260万元，但公司直至2022年6月10日、9月8日才补充披露。公司子公司大津重工于2022年11月11日收到与收益相关的政府补助500万元，但公司直至2022年11月16日才补充披露。前述行为不符合《深圳证券交易所创业板上市公司第40号--上市公司获得政府补助公告格式》的规定，违反了《上市公司信息披露管理办法》第三条第一款、第二十二条第一款、第二款第十二项、第二十六条第一款的规定。7.2022年报中与履约进度相关的财务处理。一是子公司大津重工及其泰州分公司2022年对于部分设备投入未按相同的方法确认履约进度。二是个别项目用于核算实际成本中的部分专项费用或直接人工于2022年末未及时暂估。前述行为不符合《企业会计准则第14号--收入》第十二条、《企业会计准则--基本准则》第九条（财政部令第76号）的规定，违反了《上市公司信息披露管理办法》第三条第一款的规定。你作为公司董事长，未能勤勉尽责，对公司上述行为负有责任，违反了《上市公司信息披露管理办法》第四条的规定。依据《上市公司信息披露管理办法》第五十一条、第五十二条第三项的规定，我局决定对你采取出具警示函的行政监管措施。如果对本监督管理措施不服，可以在收到本决定书之日起60日内向中国证券监督管理委员会提出行政复议申请，也可以在收到本决定书之日起6个月内向有管辖权的人民法院提起诉讼。复议与诉讼期间，上述监督管理措施不停止执行。中国证券监督管理委员会上海监管局2023年12月19日|2024-12-02 08:57:24
2023-12-19||bm56000001/2023-00014511|行政监管措施|关于对天海融合防务装备技术股份有限公司采取责令改正措施的决定|沪证监决〔2023〕356号|天海融合防务装备技术股份有限公司：经查，你公司（统一社会信用代码：9131000072942385X3）存在以下事实：1.未按规定及时披露对子公司的担保。你公司分别于2021年11月12日、11月24日、11月26日出具《不可撤销的担保书》、于2022年3月28日出具《履约保函》，约定对子公司江苏大津重工有限公司（简称“大津重工”）应向船东或出口代理方承担的债务、义务和责任承担不可撤销的连带责任，所涉担保本金合计人民币349,356,800元，你公司在股东大会审议时预计了担保额度，但未在担保事项实际发生时及时披露。你公司分别于2022年3月28日、7月27日签订保证合同，约定为子公司大津重工、江苏佳美海洋工程装备有限公司向银行的借款提供连带保证责任担保，所涉担保债权余额分别为12,000万元、200万元，但你公司分别于2022年4月20日、8月26日才补充披露。前述行为不符合《关于规范上市公司对外担保行为的通知》（证监发〔2005〕120号）第一条第五项、《上市公司监管指引第8号--上市公司资金往来、对外担保的监管要求》（证监会公告〔2022〕26号）第十二条的规定，违反了《上市公司信息披露管理办法》（证监会令第182号）第三条第一款、第二十二条第一款、第二款第一项、《中华人民共和国证券法》第八十条第二款第三项的规定。2.关联交易披露不准确。2022年11月11日、2023年1月30日，你公司子公司上海沃金天然气利用有限公司（简称“沃金天然气”）与厦门太威商贸有限公司（简称“太威商贸”）签订两份《焦炭买卖合同》，向太威商贸采购焦炭，合同金额总计20,070万元。经查，太威商贸将沃金天然气支付的采购款于同日直接或间接划转至钦实（厦门）贸易有限公司（简称“钦实集团”），沃金天然气向太威商贸采购的焦炭实质为向钦实集团采购，钦实集团为你公司实际控制人何旭东控制的企业，上述交易构成关联交易。你公司在2022年年度报告里披露对太威商贸的预付款为2,000万元；于2023年4月21日在《关于2023年日常关联交易计划的公告》中披露2022年全年、2023年以来截至披露日，公司向钦实集团采购商品或劳务的交易金额均为0。你公司在上述临时报告、定期报告中，未准确披露前述关联交易实质和金额，违反了《上市公司信息披露管理办法》第三条第一款的规定。3.你公司在2022年年报中对大宗贸易焦炭业务按净额法核算，但2021年年报、2022年半年报和季度报告中仍按总额法核算，导致相关营业收入、营业成本确认不准确，不符合《企业会计准则第14号--收入》（财会〔2017〕22号）第三十四条的规定，违反了《上市公司信息披露管理办法》第三条第一款的规定。4.2022年报中对H&CMARINEENGINEERING(SINGAPORE)PTE.LTD（简称“H&C”）坏账准备转回的会计处理不准确。你公司将应收H&C的合同价款计入主营业务收入和应收账款、将合同价款与现销价格的差异计入坏账准备核算。你公司未按规定以现销价格确定主营业务收入，亦未通过未实现融资收益等科目进行会计核算，不符合《企业会计准则第14号--收入》应用指南（2018）的相关规定，违反了《上市公司信息披露管理办法》第三条第一款的规定。5.你公司2022年年报中前五大客户、供应商相关信息披露不准确，违反了《上市公司信息披露管理办法》第三条第一款的规定。6.未按规定及时披露政府补助。你公司子公司泰州市金海运船用设备有限责任公司分别于2022年2月10日、9月2日收到与收益相关的政府补助349万元、260万元，但你公司直至2022年6月10日、9月8日才补充披露。你公司子公司大津重工于2022年11月11日收到与收益相关的政府补助500万元，但你公司直至2022年11月16日才补充披露。前述行为不符合《深圳证券交易所创业板上市公司第40号--上市公司获得政府补助公告格式》的规定，违反了《上市公司信息披露管理办法》第三条第一款、第二十二条第一款、第二款第十二项、第二十六条第一款的规定。7.2022年报中与履约进度相关的财务处理问题。一是子公司大津重工及其泰州分公司2022年对于部分设备投入未按相同的方法确认履约进度。二是个别项目用于核算实际成本中的部分专项费用或直接人工于2022年末未及时暂估。前述行为不符合《企业会计准则第14号--收入》第十二条、《企业会计准则--基本准则》（财政部令第76号）第九条的规定，违反了《上市公司信息披露管理办法》第三条第一款的规定。依据《上市公司信息披露管理办法》第五十二条第一项的规定，我局决定对你公司采取责令改正的监管措施，你公司应采取有效措施进行改正，并于收到本决定书之日起30日内向我局提交书面整改报告。我局将继续对你公司有关事项开展核查，并视核查结果采取进一步的监管安排。如果对本监督管理措施不服，可以在收到本决定书之日起60日内向中国证券监督管理委员会提出行政复议申请，也可以在收到本决定书之日起6个月内向有管辖权的人民法院提起诉讼。复议与诉讼期间，上述监督管理措施不停止执行。中国证券监督管理委员会上海监管局2023年12月19日|2024-12-02 08:57:24
2023-12-19||bm56000001/2024-00000045|行政监管措施|关于对国金期货有限责任公司上海分公司采取责令改正措施的决定|沪证监决〔2023〕347号|国金期货有限责任公司上海分公司：近期，我局对你单位（统一社会信用代码:91310115MA1HATEP1H）进行现场检查，发现存在国金期货有限责任公司总部人员使用你单位合同及业务印章、办公区域内有13台电脑设备未进行登记管理等问题，反映出你单位内部控制存在缺陷，违反了《期货公司监督管理办法》（证监会令第155号）第五十六条的规定。根据《期货公司监督管理办法》第一百零九条的规定，现决定对你单位采取责令改正的监督管理措施。你单位应在收到本决定书之日起1个月内予以改正并提交书面报告。如果对本监督管理措施不服，可以在收到本决定书之日起60日内向中国证券监督管理委员会提出行政复议申请，也可以在收到本决定书之日起6个月内向有管辖权的人民法院提起诉讼。复议与诉讼期间，上述监督管理措施不停止执行。中国证券监督管理委员会上海监管局2023年12月19日|2024-12-02 08:57:24
2023-12-19||bm56000001/2024-00000041|行政监管措施|关于对傅炳荣采取出具警示函措施的决定|沪证监决〔2023〕351号|傅炳荣：经查，2022年6月，上海鹏盾能源集团股份有限公司（统一社会信用代码：91310000774325554U，以下简称“公司”）为公司法定代表人、总经理傅瀛个人借款提供担保，担保借款总金额1090万元，占最近一期归属于母公司经审计净资产5.05%。公司未事先履行董事会、股东大会审议程序，也未及时履行信息披露义务，直至2022年8月8日，召开董事会审议并披露了《提供担保暨关联交易的公告（补发）》，并于2022年8月24日召开股东大会审议追认了上述对外担保事项。公司上述行为违反了《非上市公众公司监督管理办法》（证监会令第190号）第三条、第十四条第三款，《非上市公众公司信息披露管理办法》（证监会令第191号）第三条第一款、第二十一条第一款、第二款第三项的规定。你作为公司董事长，知悉并参与上述事项，对上述问题负有主要责任，违反了《非上市公众公司监督管理办法》第二十一条第二款，《非上市公众公司信息披露管理办法》第五条的规定。根据《非上市公众公司监督管理办法》第六十七条、《非上市公众公司信息披露管理办法》第四十五条第四项的规定，我局决定对你采取出具警示函的监管措施。如果对本监督管理措施不服，可以在收到本决定书之日起60日内向中国证券监督管理委员会提出行政复议申请，也可以在收到本决定书之日起6个月内向有管辖权的人民法院提起诉讼。复议与诉讼期间，上述监督管理措施不停止执行。中国证券监督管理委员会上海监管局2023年12月19日|2024-12-02 08:57:24
2023-12-19||bm56000001/2024-00000039|行政监管措施|关于对孙秀文采取出具警示函措施的决定|沪证监决〔2023〕350号|孙秀文：经查，2022年6月，上海鹏盾能源集团股份有限公司（统一社会信用代码：91310000774325554U，以下简称“公司”）为公司法定代表人、总经理傅瀛个人借款提供担保，担保借款总金额1090万元，占最近一期归属于母公司经审计净资产5.05%。公司未事先履行董事会、股东大会审议程序，也未及时履行信息披露义务，直至2022年8月8日，召开董事会审议并披露了《提供担保暨关联交易的公告（补发）》，并于2022年8月24日召开股东大会审议追认了上述对外担保事项。公司上述行为违反了《非上市公众公司监督管理办法》（证监会令第190号）第三条、第十四条第三款，《非上市公众公司信息披露管理办法》（证监会令第191号）第三条第一款、第二十一条第一款、第二款第三项的规定。你作为公司董事，知悉并参与上述事项，对上述问题负有主要责任，违反了《非上市公众公司监督管理办法》第二十一条第二款，《非上市公众公司信息披露管理办法》第五条的规定。根据《非上市公众公司监督管理办法》第六十七条、《非上市公众公司信息披露管理办法》第四十五条第四项的规定，我局决定对你采取出具警示函的监管措施。如果对本监督管理措施不服，可以在收到本决定书之日起60日内向中国证券监督管理委员会提出行政复议申请，也可以在收到本决定书之日起6个月内向有管辖权的人民法院提起诉讼。复议与诉讼期间，上述监督管理措施不停止执行。中国证券监督管理委员会上海监管局2023年12月19日|2024-12-02 08:57:24
2023-12-19||bm56000001/2024-00000038|行政监管措施|关于对傅瀛采取出具警示函措施的决定|沪证监决〔2023〕349号|傅瀛：经查，2022年6月，上海鹏盾能源集团股份有限公司（统一社会信用代码：91310000774325554U，以下简称“公司”）为你个人借款提供担保，担保借款总金额1090万元，占最近一期归属于母公司经审计净资产5.05%。公司未事先履行董事会、股东大会审议程序，也未及时履行信息披露义务，直至2022年8月8日，召开董事会审议并披露了《提供担保暨关联交易的公告（补发）》，并于2022年8月24日召开股东大会审议追认了上述对外担保事项。公司上述行为违反了《非上市公众公司监督管理办法》（证监会令第190号）第三条、第十四条第三款，《非上市公众公司信息披露管理办法》（证监会令第191号）第三条第一款、第二十一条第一款、第二款第三项的规定。你作为公司法定代表人、总经理，对上述问题负有主要责任，违反了《非上市公众公司监督管理办法》第二十一条第二款，《非上市公众公司信息披露管理办法》第五条的规定。根据《非上市公众公司监督管理办法》第六十七条、《非上市公众公司信息披露管理办法》第四十五条第四项的规定，我局决定对你采取出具警示函的监管措施。如果对本监督管理措施不服，可以在收到本决定书之日起60日内向中国证券监督管理委员会提出行政复议申请，也可以在收到本决定书之日起6个月内向有管辖权的人民法院提起诉讼。复议与诉讼期间，上述监督管理措施不停止执行。中国证券监督管理委员会上海监管局2023年12月19日|2024-12-02 08:57:24
2023-12-19||bm56000001/2024-00000032|行政监管措施|关于对上海鹏盾能源集团股份有限公司采取出具警示函措施的决定|沪证监决〔2023〕348号|上海鹏盾能源集团股份有限公司：经查，2022年6月，你公司（统一社会信用代码：91310000774325554U，以下简称“公司”）为公司法定代表人傅瀛个人借款提供保证担保，担保借款总金额1090万元，占最近一期归属于母公司经审计净资产5.05%。公司未事先履行董事会、股东大会审议程序，也未及时履行信息披露义务，直至2022年8月8日，召开董事会审议并披露了《提供担保暨关联交易的公告（补发）》，并于2022年8月24日召开股东大会审议追认了上述对外担保事项。公司上述行为违反了《非上市公众公司监督管理办法》（证监会令第190号）第三条、第十四条第三款，《非上市公众公司信息披露管理办法》（证监会令第191号）第三条第一款、第二十一条第一款、第二款第三项的规定。根据《非上市公众公司监督管理办法》第六十七条、《非上市公众公司信息披露管理办法》第四十五条第四项的规定，我局决定对你公司采取出具警示函的监管措施。如果对本监督管理措施不服，可以在收到本决定书之日起60日内向中国证券监督管理委员会提出行政复议申请，也可以在收到本决定书之日起6个月内向有管辖权的人民法院提起诉讼。复议与诉讼期间，上述监督管理措施不停止执行。中国证券监督管理委员会上海监管局2023年12月19日|2024-12-02 08:57:24
2023-12-19||bm56000001/2023-00014574|行政监管措施|关于对上海三商资产管理有限公司采取出具警示函措施的决定|沪证监决〔2023〕362号|上海三商资产管理有限公司：经查，你公司（上海三商资产管理有限公司，统一社会信用代码：913102303326475056）在开展私募基金业务中，存在以下事实：一、委托不具有基金销售业务资格的单位或个人从事资金募集活动，不符合《关于加强私募投资基金监管的若干规定》(证监会公告〔2020〕71号）第六条第一款第八项的规定，违反《私募投资基金监督管理暂行办法》（证监会令第105号）第二十三条第九项规定。二、委托他人制作、收集部分投资者适当性材料，未将部分专业投资者的认定结果告知投资者，也未按普通投资者类别履行告知、警示等适当性义务，在适当性管理过程中，未勤勉尽责，审慎履职，违反《证券期货投资者适当性管理办法》（证监会令第130号，经证监会令第177号、第202号修改）第三条规定。根据《私募投资基金监督管理暂行办法》第三十三条、《证券期货投资者适当性管理办法》第三十七条的规定，现决定对你公司采取出具警示函的监督管理措施。你公司应当加强相关法律法规的学习，强化人员合规守法意识，采取切实有效措施依法合规经营。如果对本监督管理措施不服，可以在收到本决定书之日起60日内向中国证券监督管理委员会提出行政复议申请，也可以在收到本决定书之日起6个月内向有管辖权的人民法院提起诉讼。复议和诉讼期间，上述监督管理措施不停止执行。中国证券监督管理委员会上海监管局2023年12月19日|2024-12-02 08:57:24
